,ADDNTL_FUEL_MODEL_IDENTIFIER,ANTICIPATED_COMPLETION_DATE,APPROVED_BY,APPROVED_DATE,AREA_CLOSURE_FLAG,CAUSE_IDENTIFIER,COMPLEXITY_LEVEL_IDENTIFIER,COMPLEXITY_LEVEL_NARR,CREATED_BY,CREATED_DATE,CRIT_RES_NEEDS_12,CRIT_RES_NEEDS_24,CRIT_RES_NEEDS_48,CRIT_RES_NEEDS_72,CRIT_RES_NEEDS_GT72,CURRENT_THREAT_12,CURRENT_THREAT_24,CURRENT_THREAT_48,CURRENT_THREAT_72,CURRENT_THREAT_GT72,CURR_INCIDENT_AREA,CURR_INC_AREA_UOM_IDENTIFIER,CY,DATA_ENTRY_STATUS,DISCOVERY_DATE,DISPATCH_PRIORITY,DONWCGU_PROT_UNIT_IDENTIFIER,EST_IM_COST_TO_DATE,EXPECTED_CONTAINMENT_DATE,FIRE_BEHAVIOR_1_IDENTIFIER,FIRE_BEHAVIOR_2_IDENTIFIER,FIRE_BEHAVIOR_3_IDENTIFIER,FUEL_MODEL_IDENTIFIER,GACC_PRIORITY,GEN_FIRE_BEHAVIOR_IDENTIFIER,HAZARDS_MATLS_INVOLVMENT_NARR,ID,INC209R_IDENTIFIER,INCIDENT_COMMANDERS_NARR,INCIDENT_DESCRIPTION,INCIDENT_JURISDICTION,INCIDENT_NAME,INCIDENT_NUMBER,INCTYP_IDENTIFIER,INC_IDENTIFIER,INC_MGMT_ORG_IDENTIFIER,LAST_MODIFIED_BY,LAST_MODIFIED_DATE,LIFE_SAFETY_HEALTH_STATUS_NARR,LOCAL_TIMEZONE_IDENTIFIER,MANAGEMENT_CODE,PCT_CONTAINED_COMPLETED,PCT_CONT_COMPL_UOM_IDENTIFIER,PCT_PERIM_TO_BE_CONTAINED,PLANNED_ACTIONS,POO_CITY,POO_COUNTY_CODE,POO_DONWCGU_OWN_IDENTIFIER,POO_LATITUDE,POO_LD_PM_IDENTIFIER,POO_LD_QTR_QTR_QTR_QTR_SEC,POO_LD_QTR_QTR_QTR_SEC,POO_LD_QTR_QTR_SEC,POO_LD_QTR_SEC,POO_LD_RGE,POO_LD_SEC,POO_LD_TWP,POO_LONGITUDE,POO_SHORT_LOCATION_DESC,POO_STATE_CODE,POO_US_NGR_XCOORD,POO_US_NGR_YCOORD,POO_US_NGR_ZONE,POO_UTM_EASTING,POO_UTM_NORTHING,POO_UTM_ZONE,PREPARED_BY,PREPARED_DATE,PROJECTED_ACTIVITY_12,PROJECTED_ACTIVITY_24,PROJECTED_ACTIVITY_48,PROJECTED_ACTIVITY_72,PROJECTED_ACTIVITY_GT72,PROJECTED_FINAL_IM_COST,PROJ_INCIDENT_AREA,PROJ_INC_AREA_UOM_IDENTIFIER,PROJ_SIG_RES_DEMOB_START_DATE,REMARKS,REPORT_FROM_DATE,REPORT_NUMBER,REPORT_TO_DATE,ROAD_CLOSURE_FLAG,SECNDRY_FUEL_MODEL_IDENTIFIER,SIGNIF_EVENTS_SUMMARY,SINGLE_COMPLEX_FLAG,STATUS,STRATEGIC_DISCUSSION,STRATEGIC_OBJECTIVES,SUBMITTED_DATE,SUBMITTED_TO,TRAIL_CLOSURE_FLAG,UNIFIED_COMMAND_FLAG,UNIT_OR_OTHER_NARR,WEATHER_CONCERNS_NARR
94,,,,,,87.0,,4,SIT209,2014-01-27 16:29:02,,,,,,,,,,,143.0,20928.0,,D,2014-01-23 17:00:00,,226076,,,,,,,,,,,258889,D. Price - ODF G. Novak - Industry,,,Alder Creek,14OR-711S-030914,9851.0,258888,178.0,SIT209,2014-01-27 16:29:02,,,,100.0,,100.0,,,,,,,,,,,,,,,,,,,,,,,,,,,,,,,,,,,2014-01-23 17:00:00,,2014-01-27 19:00:00,,,,S,F,,,,,,,,
229,,2014-02-26 12:00:00,David Comingdeer ICT4,2014-02-27 11:36:53,,87.0,,,SIT209,2014-02-27 11:13:15,Hand Crew and Helicopter,,,,,None,,,,,325.0,20928.0,,A,2014-02-25 16:30:00,,8125,12000.0,,,,,10808.0,,,,,287819,David Comingdeer,,,SONNY GILE CREEK,039,9851.0,287818,178.0,SIT209,2014-02-27 11:36:53,Very active fire behavior,,H11F,60.0,,40.0,Improve Line and continue to mop-up and patrol.,,1.0,8125.0,35.646944399999995,,,,,,,,,-94.6405556,"37 miles East of Musgokee, OK",40.0,,,,,,,Elmer O. BIA/AOICC,2014-02-26 16:00:00,10 acres,,,,,20000.0,325.0,20928.0,2014-02-25 12:00:00,,2014-02-25 16:30:00,,2014-02-26 17:00:00,,,Short runs  Creeping and Smoldering,S,I,,Continue line construction,2014-02-27 11:36:53,SACC,,,,NE winds at 11 mph sustained w/ Gust at 24 mph  Temps in the 50's and low RH
230,,2014-02-26 12:00:00,Scott Swendsen / AOICC Center Manager,2014-03-03 15:34:33,,87.0,,,SIT209,2014-03-03 15:32:36,Hand Crew and Helicopter,,,,,None,,,,,325.0,20928.0,,A,2014-02-25 16:30:00,,8125,0.0,,,,,10808.0,,,,,291912,David Comingdeer,,,SONNY GILE CREEK - DUPLICATE do not use,039,9851.0,287818,178.0,SIT209,2014-03-03 15:34:33,Very active fire behavior,,H11F,100.0,,0.0,Improve Line and continue to mop-up and patrol.,,1.0,8125.0,35.646944399999995,,,,,,,,,-94.6405556,"37 miles East of Musgokee, OK",40.0,,,,,,,Scott Swendsen / AOICC Center Manager,2014-03-03 15:30:00,10 acres,,,,,20000.0,325.0,20928.0,2014-02-25 12:00:00,,2014-02-25 22:00:00,,2014-02-26 22:00:00,,,Short runs  Creeping and Smoldering,S,U,,Continue line construction,2014-03-03 15:34:33,SACC,,,,NE winds at 11 mph sustained w/ Gust at 24 mph  Temps in the 50's and low RH
231,,2014-02-26 12:00:00,Scott Swendsen / AOICC Center Manager,2014-03-03 15:38:02,,87.0,,,SIT209,2014-03-03 15:35:23,,,,,,None,,,,,325.0,20928.0,,A,2014-02-25 16:30:00,,8125,0.0,,,,,10808.0,,,,,291933,David Comingdeer,,,SONNY GILE CREEK - DUPLICATE do not use,039,9851.0,287818,,SIT209,2014-03-03 15:38:02,,,H11F,100.0,,0.0,,,1.0,8125.0,35.646944399999995,,,,,,,,,-94.6405556,"37 miles East of Musgokee, OK",40.0,,,,,,,Scott Swendsen / AOICC Center Manager,2014-03-03 15:30:00,None,,,,,20000.0,,,2014-02-25 12:00:00,,2014-02-26 22:00:00,,2014-03-03 15:30:00,,,Short runs  Creeping and Smoldering,S,F,,,2014-03-03 15:38:02,SACC,,,,
1575,,2014-06-15 12:00:00,CRAIG CRENSHAW,2014-06-15 13:42:49,,88.0,,TYPE 4,fws0014,2014-06-15 13:27:03,,,,,,None.,,,,,1300.0,20928.0,,A,2014-06-13 07:30:00,,8757,40000.0,,,,,10800.0,,,,,503093,C CRENSHAW,,,WF DIPPING VATS 2014,00H5XY,9851.0,503092,178.0,SIT209,2014-06-15 13:42:49,,,H5XY,100.0,,100.0,,SABINE PASS,245.0,8757.0,26.5883333,,,,,,,,,-94.4413889,"8 MILES WEST OF SABINE PASS, TEXAS",48.0,,,,,,,MARIA VIELMA,2014-06-15 13:30:00,Fires out  demobing of resources.,,,,,40000.0,,,2014-06-15 12:00:00,Initital 209 had incorrect Unit Identifier of TX-AHR.  Correct Unit Identifier for 209 for WF Dippiing Vats 2014 is TX-MCR.,2014-06-15 07:30:00,,2014-06-15 13:30:00,,,No significant smokes after burn out operations that were done yesterday.,S,F,,,2014-06-15 13:42:49,"SACC BY LETY HANDY, TICC 6-15-14 1342",,,,None.
1664,,2014-06-24 14:00:00,Deputy Chief Greg Fish,,,90.0,,,DWISE001,2014-06-24 14:32:37,None.,None.,,,,,,,,,150.0,20928.0,,D,2014-06-22 12:30:00,,9099,,,,,,10804.0,,,,,534057,,,,BRAND,038084,9851.0,533486,181.0,SIT209,2014-06-24 14:32:37,Minor injuries to two firefighters from rolling boulders; treated and released,,,34.0,,66.0,100% Containment within next 24 hours.,Glendale,37.0,9099.0,34.1825,,,,,,,,,-118.2763889,,6.0,,,,,,,Exec. Admin. Don WIse,2014-06-23 13:30:00,Small potential for spread.,Small potential for spread.,,,100% Containment,,175.0,20928.0,2014-06-24 14:00:00,,2014-06-22 14:30:00,,2014-06-23 03:00:00,,,Active fire,S,U,Mop - up mode 150 feet into perimeter area,100% Containment within next 24 hours.,,"Glendale Fire, City of Glendale",,,,Windspeed = 10 mph / Windgusts = 17 mph / Visibility = 10 mi. / Overall Weather Outlook = Fair / Sky = Clear / Temperature = 77 deg. / Dewpoint = 56 / Relative Humidity = 48% /
3431,,,,,,,,,iahirsch,2014-07-29 14:35:08,,,,,,,,,,,,,,D,2014-07-28 02:00:00,,484038,,,,,,,,,,,720751,To complete,,,REEVES CREEK,014915,9851.0,720750,,iahirsch,2014-07-29 14:35:08,,,,0.0,,100.0,,,,,,,,,,,,,,,,,,,,,,,,,,,,,,,,,,,2014-07-28 02:00:00,,2014-07-29 23:00:00,,,,S,I,,,,,,,,
6193,,,,,N,1536117.0,,4,SIT209,01/27/2014 16:29:02,,,,,,,,,,,143.0,1536109.0,2015.0,D,01/23/2014 17:00:00,,1527346,,,,,,,,,,9.0,2714130,D. Price - ODF G. Novak - Industry,,,Alder Creek,14OR-711S-030914,1536179.0,2714129,1536138.0,SIT209,01/27/2014 16:29:02,,,,100.0,,100.0,,,,,,,,,,,,,,,,,,,,,,,,,,,,,,,,,,,01/23/2014 17:00:00,,2014-01-27 19:00:00,N,,,S,F,,,,,N,N,,
6253,,,EOR-DO,02/02/2015 14:19:01,N,1536117.0,,,Eoroscosr,02/02/2015 14:11:24,,,,,,None,,,,,130.0,1536109.0,2015.0,A,01/29/2015 8:45:00,,1525558,1450.0,,,,,1535989.0,,,,69.0,2717233,Winkler,,,POLECAT CREEK,015020,1536179.0,2717232,1536138.0,SIT209,02/04/2015 10:42:30,,,JH45,100.0,,0.0,,,135.0,1525558.0,35.5533333,,,,,,,,,-94.5947222,"2 Miles NW of Belfonte, OK",40.0,,,,,,,Orosco - BIA/AOICC,02/02/2015 14:00:00,None,,,,,,,,,,01/29/2015 9:00:00,,2015-01-31 13:00:00,N,,No activity,S,F,,,02/02/2015 14:19:01,SACC,N,N,,
6254,,,EOR-DO,02/03/2015 11:21:00,N,1536117.0,,,Eoroscosr,02/03/2015 11:18:39,,,,,,None,,,,,130.0,1536109.0,2015.0,A,01/29/2015 8:45:00,,1525558,1450.0,,,,,1535989.0,,,,70.0,2717241,Winkler,,,POLECAT CREEK,015020,1536179.0,2717232,1536138.0,SIT209,02/04/2015 10:42:30,,,JH45,100.0,,0.0,,,135.0,1525558.0,35.5533333,,,,,,,,,-94.5947222,"2 Miles NW of Belfonte, OK",40.0,,,,,,,Orosco - BIA/AOICC,02/03/2015 11:00:00,None,,,,,,,,,,02/02/2015 14:00:00,,2015-02-03 11:00:00,N,,No activity,S,F,,,02/03/2015 11:21:00,SACC,N,N,,
6288,,03/15/2014 14:00:00,Rick Napoles,,N,1536120.0,,low,jill,05/14/2014 17:49:53,None,NONE,NONE,NONE,NONE,None,None,None,None,,3.0,1536109.0,2015.0,D,03/05/2014 10:00:00,,1525765,45808.0,,,,,1535982.0,,,Suppression stratgy is confinement.,104.0,2714794,Todd McDivitt  CA-INF   3/27/2014 KURT ALLENDORF  CA-INF  4/23/14 Rick Napoles (Div4)CA-INF,,,Blackrock,210,1536179.0,2714793,1536138.0,SIT209,05/14/2014 19:11:10,,,P5H2CQ,100.0,,0.0,None,big pine,27.0,1525765.0,36.9006667,1536080.0,,,SE,,33e,14.0,12s,-118.31766670000002,"Sawmill Cyn,South of Spook Cyn,North of Sawmill Meadow. North aspect of hogback",6.0,,,,,,,Jill K. Erhard-Moore,05/14/2014 19:00:00,fire is declared out,,,,,45808.0,3.0,1536109.0,, This fire is declared out by the line officer on 4/29/14 @1200.  The fire is still under investigation.  The ignition date changed to 3/5/14. this is based on wilderness use permits that were issued for the area and observed fire behavior.,05/08/2014 20:00:00,,2014-05-14 19:00:00,N,,Observed fire behavior- no visable fire behavior  no smoke showing  no activity.,S,F,None,Suppression by confinement.,,OVICC,N,N,,None
6304,,,EOR Duty Officer,02/12/2015 17:16:03,N,1536117.0,,,Eoroscosr,02/12/2015 17:14:20,,,,,,None,,,,,102.0,1536109.0,2015.0,A,02/08/2015 14:30:00,,1525558,1000.0,,,,,1535989.0,,,,120.0,2714880,Morris,,,LOW GAP,015030,1536179.0,2714879,1536138.0,SIT209,02/12/2015 17:16:03,,,JH83,100.0,,0.0,,,135.0,1525558.0,35.6191667,,,,,,,,,-94.6136111,"3.3 Miles NE of Stoney Point, OK",40.0,,,,,,,Orosco - BIA/AOICC,02/12/2015 17:00:00,None,,,,,,,,,,02/08/2015 14:30:00,,2015-02-11 17:00:00,N,,No Information provided.,S,F,,,02/12/2015 17:16:03,SACC,N,N,,
6372,,,JOHN KIRKSEY,08/11/2015 16:31:15,N,1536117.0,1535968.0,,Bogart,07/15/2015 12:49:05,,,,,,No current threats.  Fire is lined and burned out and will continue to be monitored.  Weather forecast is favorable.,,,,,189.0,1536109.0,2015.0,A,03/14/2014 17:00:00,,1526114,1000.0,,,,,1535990.0,,1536370.0,,188.0,2715191,Doug Lynn,,,Copper Hollow Road,ETD0005,1536179.0,2715190,,SIT209,08/11/2015 16:31:15,,1536268.0,,100.0,,100.0,,"Tellico Plains, TN",123.0,1527355.0,35.24388889999999,,,,,,,,,-84.2908333,1 mile off Highway 68 down the Old Copper Hollow Road,47.0,,,,,,,CHARLES VIA,04/16/2014 8:00:00,Fire has been burned out.  A few hot spots remain in stumps and brush piles. Potential to move outside lines is low.  Weather forecast is favorable.,,,,,,,,,,03/14/2014 17:00:00,,2014-03-15 18:45:00,N,,Fuel Model: Hardwood Litter,S,F,,,08/11/2015 16:31:15,TN-TNS,N,N,,
6413,,,,,N,1536120.0,,Complex,ajohansson,05/23/2014 12:39:12,,,,,,,,,,,3000.0,1536109.0,2015.0,D,05/23/2014 3:00:00,,1525583,,,,,,,,,,229.0,2716863,Johansson,,,Test - Complex,000001,1536179.0,2716862,1536139.0,ajohansson,05/23/2014 12:39:12,,,,0.0,,45.0,,,,,,,,,,,,,,,,,,,,,,,,,,,,,,,,,,,05/23/2014 7:00:00,,2014-05-23 09:00:00,N,,,C,I,,,,,N,N,,
6792,,07/01/2015 12:00:00,Don Fortier,07/01/2015 6:47:50,N,1536120.0,1535969.0,,wslo225,07/01/2015 6:40:27,4 engine strike teams  overhead,,,,,20 residences  standing agricultural crops,,,,,2100.0,1536109.0,2015.0,A,07/01/2015 0:45:00,,1526224,25000.0,,,,,1535985.0,,1536368.0,,608.0,2722849,Don Fortier  Grant County FD3,,,Monument FIre,000601,1536179.0,2722848,1536138.0,SIT209,07/01/2015 6:47:50,,1536273.0,,20.0,,100.0,,Quincy,25.0,1526224.0,47.283055600000004,1536107.0,,,,SE,24e,26.0,21n,-119.75388889999999,"6 miles north of Quincy, WA",53.0,,,,,,,Bill Slosson,07/01/2015 6:45:00,continue perimeter control,patrol and mopup,,,,200000.0,3500.0,1536109.0,07/01/2015 12:00:00,,07/01/2015 1:45:00,,2015-07-01 11:00:00,Y,1535983.0,,S,I,limited local resources,100% containtment,07/01/2015 6:47:50,NWCC,N,N,,Wind and low RH
6793,,07/01/2015 12:00:00,D. Fortier,08/06/2015 18:59:16,N,1536120.0,1535969.0,,wslo225,08/06/2015 18:58:51,,,,,,None.,,,,,2100.0,1536109.0,2015.0,A,07/01/2015 0:45:00,,1526224,200000.0,,,,,1535985.0,,1536370.0,,609.0,2722860,Don Fortier  Grant County FD3,,,Monument FIre,000601,1536179.0,2722848,1536138.0,SIT209,08/06/2015 18:59:16,,1536273.0,,100.0,,100.0,,Quincy,25.0,1526224.0,47.283055600000004,1536107.0,,,,SE,24e,26.0,21n,-119.75388889999999,"6 miles north of Quincy, WA",53.0,,,,,,,Bill Slosson,08/06/2015 19:00:00,Contained and controlled. ,,,,,200000.0,3500.0,1536109.0,07/01/2015 12:00:00,Final report. ,07/31/2015 19:00:00,,2015-08-06 19:00:00,N,,,S,F,,,08/06/2015 18:59:16,OR-NWC,N,N,,
7272,,11/20/2014 12:00:00,b. garinger,03/09/2015 19:29:57,N,1536120.0,,,tapina01,11/18/2014 12:14:48,,,,,,Unknown,Unknown,Unknown,Unknown,Unknown,10.0,1536112.0,2015.0,A,11/18/2014 5:45:00,,1526195,1.0,,,,,,,,HAZARDOUS CHEMICALS,1088.0,2735923,Ventura County Fire IC Chief Ortega,EXPLOSION W HAZMAT RELEASE,VNC,MISSION,14-0075269,1536186.0,2735922,,SIT209,06/03/2015 16:47:25,,1536273.0,,2.0,,0.0,,,111.0,1526195.0,34.3225,1536095.0,,,SE,SW,21W,20.0,3N,-119.10333329999999,SOUTH OF 126 WEST OF SANTA PAULA CITY,6.0,,,,306398.0,3799921.0,11.0,D. Zinskey,03/09/2015 20:00:00,12 hour prediction potential of 200-300 residences 500+ persons. Adverse impacts to 3 area hospitals with contaminated patients and response personnel. Equipment being positioned to handle increased medical potential. Cal Fire mobilization maintained for ,Large populous evacuation. Contaminated plume identification. Potential for declared local emergency. Continued backtrack of product related to incident. Per the DC,Continued monitoring of injured citizens and responders. Per the DC,Unknown,Unknown,,,,,Unable to enter estimated incident cost to date,03/09/2015 8:00:00,,2015-03-09 20:00:00,N,,VACUUM TRUCK EXPLODED AND RELEASED UNK SUBSTANCE WITH REACTION AND VAPOR CLOUD,S,F,,,03/09/2015 19:29:57,Region 1,N,Y,,Sustained moderate north eastern wind predicted to switch to a westerly wind this evening.
7273,,11/20/2014 12:00:00,Chief Vandenbossche,11/18/2014 13:35:09,N,1536120.0,,,tapina01,11/18/2014 12:14:48,,,,,,Unknown,Unknown,Unknown,Unknown,Unknown,10.0,1536112.0,2015.0,A,11/18/2014 5:45:00,,1526195,1000000.0,,,,,,,,HAZARDOUS CHEMICALS,1089.0,2735930,Ventura County Fire IC Chief Ortega,EXPLOSION W HAZMAT RELEASE,VNC,MISSION,14-0075269,1536186.0,2735922,,SIT209,06/03/2015 16:47:25,,1536273.0,,2.0,,0.0,,,111.0,1526195.0,34.3225,1536095.0,,,SE,SW,21W,20.0,3N,-119.10333329999999,SOUTH OF 126 WEST OF SANTA PAULA CITY,6.0,,,,306398.0,3799921.0,11.0,"Pina, Tim A.",11/18/2014 12:30:00,12 hour prediction potential of 200-300 residences 500+ persons. Adverse impacts to 3 area hospitals with contaminated patients and response personnel. Equipment being positioned to handle increased medical potential. Cal Fire mobilization maintained for ,Large populous evacuation. Contaminated plume identification. Potential for declared local emergency. Continued backtrack of product related to incident. Per the DC,Continued monitoring of injured citizens and responders. Per the DC,Unknown,Unknown,,,,,Unable to enter estimated incident cost to date,11/18/2014 5:45:00,,2014-11-18 20:00:00,N,,VACUUM TRUCK EXPLODED AND RELEASED UNK SUBSTANCE WITH REACTION AND VAPOR CLOUD,S,I,,,11/18/2014 13:35:09,RO1,N,Y,,Sustained moderate north eastern wind predicted to switch to a westerly wind this evening.
7274,,,,,N,1536117.0,1535969.0,,kditmanson,04/28/2015 12:43:50,,,,,,,,,,,935.0,1536109.0,2015.0,D,04/26/2015 20:00:00,,1526425,,,,,,,,,,1090.0,2735947,Jesse Holguin,GrassFire,,Pinon Wells,000128,1536179.0,2735946,1536138.0,kditmanson,04/28/2015 12:43:50,,1536272.0,,100.0,,0.0,,,,,,,,,,,,,,,,,,,,,,,,,,,,,,,,,,,04/26/2015 23:00:00,,2015-04-28 13:00:00,N,,,S,F,,,,,N,N,,
7386,,,Paul Hannemann,04/14/2015 8:17:13,N,1536117.0,1535968.0,,swhitleyeoc,04/14/2015 8:11:46,,,,,,none,,,,,317.0,1536109.0,2015.0,A,04/08/2015 12:15:00,,1526141,0.0,,,,,1535983.0,,,,1202.0,2728274,local IC Jusack w/Potter County,,,Frying Pan,001007,1536179.0,2728273,,SIT209,06/03/2015 16:47:25,,,,100.0,,0.0,,,375.0,1527358.0,35.3255556,,,,,,,,,-102.1230556,"5 miles SW of Boden, TX.",48.0,,,,,,,Shawn Whitley,04/14/2015 8:15:00,none,,,,,,,,,,04/10/2015 8:00:00,,2015-04-10 17:00:00,N,,none,S,F,,,04/14/2015 8:17:13,SACC,N,Y,,
7400,,04/13/2015 12:00:00,Ronda Estey,10/14/2015 14:13:03,N,1536120.0,1535969.0,,dnygaard,10/14/2015 14:11:48,None,,,,,None,,,,,350.0,1536109.0,2015.0,A,04/13/2015 19:56:00,,1525910,20000.0,,,,,1535983.0,,1536370.0,,1216.0,2728407,Kent Wolf,,,TANSEM,000014,1536179.0,2728406,1536138.0,SIT209,10/14/2015 14:13:03,,,JMN8,100.0,,100.0,Monitor,Howley,27.0,1527326.0,46.663611100000004,,,,,,,,,-96.2061111,At Barnsvillle MN,27.0,,,,,,,Diane Nygaard,04/18/2015 16:30:00,Monitor,,,,,20000.0,330.0,1536109.0,,,04/14/2015 12:00:00,,2015-04-18 16:00:00,N,,Suppressed,S,F,None,Monitor,10/14/2015 14:13:03,EACC,N,N,,
7677,,05/06/2015 12:00:00,Greg Vollhaber,,N,1536120.0,1535969.0,,biglesen,12/10/2015 8:46:38,Heavy equipment and Engine 6 / tracked vehicles for mop-up.,Tracked vehicles for mop-up.,,,,agricultural land,agricultural land.,,,,250.0,1536109.0,2015.0,D,05/02/2015 15:30:00,,1525834,42000.0,,,,,1535981.0,,1536370.0,Grass and Peat,1493.0,2730456,Mike Ware Minnesota DNR Forestry Bemidji MN,,,Redland Peat Fire,111064,1536179.0,2730455,1536138.0,SIT209,12/10/2015 9:01:09,Private agriculture land threatened. Potential for peat burning will require extensive mop-up  Snags in wooded area.,1536266.0,13B11,90.0,,100.0,Mop-up and monitor.,Gully,119.0,1525834.0,47.893666700000004,1536253.0,,,SW,SE,39,17.0,151,-95.6738333,12 miles N of Gully MN,27.0,,,,,,,Mike Ware,05/04/2015 18:00:00,Continued smoldering in peat.,smoldering in peat.,smoldering in peat.,Smoldering in peat.,,55000.0,567.0,1536109.0,05/04/2015 12:00:00,,05/02/2015 15:30:00,,2015-05-02 18:00:00,N,,Smoldering in peat.,S,F,With assigned resources  objectives should be met in the first operational period.,Full suppression and mop-up of fire area including organic soils (peat).,,EACC,N,N,,Continued warm temps.  Low RH. Is making peat mopup more extensive.
8830,,,CORDELL TAYLOR,,N,1536118.0,,T5,cnelsen,07/27/2014 21:43:58,,,,,,,,,,,0.1,1536109.0,2015.0,D,07/23/2014 16:30:00,,1524883,,,,,,,,,,2646.0,2766107,Lewis Rasband   ASF,"14 miles NE of Tabiona, UT",,MNERS GULCH,000219,1536179.0,2766106,1536139.0,SIT209,07/27/2014 21:54:22,,,,0.0,,0.0,,,,,,,,,,,,,,,,,,,,,,,CHERYL NELSEN,07/27/2014 22:00:00,,,,,,,3500.0,1536109.0,,Very minimal fire behavior.,07/23/2014 19:45:00,,2014-07-27 21:45:00,N,,,S,I,,,,EBC,N,N,,
8885,,,bschieber,,N,1536119.0,,,bschieber,07/28/2014 14:05:36,None,,,,,,,,,,,,2015.0,D,07/28/2014 9:00:00,,1525648,100.0,,,,,,,,,2701.0,2766429,Schieber  North Ops Intel,,,Test,999998,1536200.0,2766428,,SIT209,07/28/2014 14:07:42,,,,0.0,,2.0,,,87.0,1525648.0,37.050277799999996,,,,,,,,,-122.0725,Felton CALFIRE HQ,6.0,,,,,,,bschieber,07/28/2014 14:00:00,Testing Print Issue,,,,,,,,,,07/28/2014 10:00:00,,2014-07-28 13:00:00,N,,,S,I,,,,CNR,N,N,,
10365,,,,,N,1536117.0,,Type 3,bgeringer,01/07/2015 16:18:53,,,,,,,,,,,9.0,1536109.0,2015.0,D,11/18/2014 5:45:00,,1527283,,,,,,,,,Sodium chlorites  peroxides,4181.0,2809143,Plott/Cooper/Maxwell/Guzman,,Ventura County,Mission,14-0075269,1536186.0,2809142,,SIT209,06/03/2015 16:47:25,,1536273.0,,100.0,,100.0,,Santa Paula,111.0,1527283.0,34.3147222,,,,,,,,,-119.1038889,"2.5 miles SW of the city of Santa Paula, CA",6.0,,,,,,,,,,,,,,,,,,,11/18/2014 12:00:00,,2015-01-07 12:30:00,N,,At approximately 0630 on 11/18/2014  the product from the vehicle explosion had crystallized on the ground. The material was found to be ignitable by friction and evacuation of the hot zone was initiated. At 0730  adjacent plastic totes of stored chemicals began igniting. White and black smoke and vapor cloud initially drifted west and then NW after a wind shift.,S,F,,,,,N,Y,CA-VNC,
11326,,,,,N,,,,iahirsch,07/29/2014 14:35:08,,,,,,,,,,,,,2015.0,D,07/28/2014 2:00:00,,1527027,,,,,,,,,,5142.0,2820037,To complete,,,REEVES CREEK,014915,1536179.0,2820036,,iahirsch,07/29/2014 14:35:08,,,,0.0,,100.0,,,,,,,,,,,,,,,,,,,,,,,,,,,,,,,,,,,07/28/2014 2:00:00,,2014-07-29 23:00:00,N,,,S,I,,,,,N,N,,
11898,,,JOHN KIRKSEY,08/11/2015 16:42:54,N,1536117.0,1535968.0,,Bogart,07/15/2015 13:14:22,,,,,,No current threats.  Fire is lined and burned out and will continue to be monitored.  Weather forecast is favorable.,,,,,250.0,1536109.0,2015.0,A,04/13/2014 13:45:00,,1526114,1000.0,,,,,1535990.0,,1536370.0,,5714.0,2839680,Steve Roark,Arson,,Stoney Fork Road,ETD0014,1536179.0,2839679,,SIT209,08/11/2015 16:42:54,,1536268.0,,100.0,,100.0,,"Duff, TN",13.0,1527355.0,36.52,,,,,,,,,-83.98861109999999,Ridge top - 1 mile east of Chadwell Cemetery off White Oak Road.,47.0,,,,,,,CHARLES VIA,04/17/2014 19:30:00,Fire has been burned out.  A few hot spots remain in stumps and brush piles. Potential to move outside lines is low.  Weather forecast is favorable.,,,,,,,,,,04/13/2014 13:45:00,,2014-04-14 12:00:00,N,,Steep terrain with 5 to 8ft flame length.,S,F,,,08/11/2015 16:42:54,TN-TNS,N,N,,
12150,,,CRAIG MARQUARDT,02/19/2015 15:17:12,N,1536117.0,,,bemmert,02/19/2015 15:12:00,,,,,,NO ACTIVITY  FIRE SUPPRESSED 2-10-15,,,,,650.0,1536109.0,2015.0,A,02/10/2015 13:00:00,,1525956,1500.0,,,,,1535983.0,,,,5966.0,2836777,BRIAN RYLES,EXCAPED PRESCRIBED BURN,,Cherry Fire,20050A,1536179.0,2836776,1536138.0,SIT209,02/19/2015 15:17:12,,1536266.0,,100.0,,0.0,,,77.0,1525956.0,34.694166700000004,,,,,,,,,-95.268,"THIRTY TWO MILES SOUTHEAST OF McALESTER, OK",40.0,,,,,,,BRIAN EMMERT,02/19/2015 13:15:00,NO ACTIVITY  FIRE SUPPRESSED 2-10-15,,,,,,,,,,02/10/2015 13:00:00,,2015-02-19 15:00:00,N,,LOW HUMIDITY  HIGH TEMPERATURE  GUSTING WINDS,S,F,,,02/19/2015 15:17:12,SACC,N,N,,
12261,,01/19/2015 12:00:00,Craig Marquardt,01/29/2015 18:14:19,N,1536117.0,,,bemmert,01/28/2015 10:21:12,,,,,,No Activity.  Fire controlled 1/18/15 24:00,,,,,120.0,1536109.0,2015.0,A,01/18/2015 16:45:00,,1525956,11500.0,,,,,1535982.0,,,Pine timber,6077.0,2837429,Abe Grey,,,Little Beauty,20015A,1536179.0,2837428,1536138.0,SIT209,01/29/2015 18:14:19,,1536266.0,,100.0,,0.0,,,121.0,1525956.0,34.724166700000005,,,,,,,,,-95.6877778,"5 1/2 miles Southeast of Blanco, Oklahoma",40.0,,,,,,,Brian Emmert,01/28/2015 10:30:00,No Activity.  Fire controlled 1/18/15 24:00,,,,,,120.0,1536109.0,,,01/18/2015 16:45:00,,2015-01-19 00:00:00,N,,Red Flag Warning noon to 18:00,S,F,,,01/29/2015 18:14:19,SACC,N,N,,Red Flag Warning Noon to 18:00
12382,,,S Russell,01/21/2015 12:07:38,N,1536120.0,,,srussell,01/21/2015 12:06:15,,,,,,,,,,,147.0,1536109.0,2015.0,A,01/19/2015 17:15:00,,1524879,1000.0,,,,,1535989.0,,,,6198.0,2852048,B Harris,,,Toney Bend,0013D8,1536179.0,2852047,,SIT209,01/21/2015 12:07:38,,1536266.0,,100.0,,0.0,,Caney,89.0,1527223.0,36.023888899999996,,,,,,,,,-92.5647222,"4 miles SE of Caney,AR",5.0,,,,,,,Donald Cooper,01/21/2015 9:30:00,,,,,,,,,,,01/19/2015 17:15:00,,2015-01-20 12:00:00,N,,,S,F,,,01/21/2015 12:07:38,GACC,N,N,,
12511,,12/27/2014 12:00:00,Gary Cook,12/25/2014 17:48:43,N,1536117.0,,Moderate,cwebb,12/24/2014 18:27:00,none,,,,,Powe lines to the north.  Highway / Primary Rd to the north and east.,,,,,500.0,1536109.0,2015.0,A,12/23/2014 17:30:00,,1526350,50000.0,,,,,1535984.0,,,Salt Cedar  Arrowweed  Cat Tails,6327.0,2847977,Gary Cook,,,Walker,001124,1536179.0,2847976,1536137.0,SIT209,12/25/2014 17:48:43,,1536224.0,JG8L,50.0,,50.0,Hold existing control lines and begin mop up.,,27.0,1527031.0,32.8555556,,,,,,,,,-114.44555559999999,15 miles north of Yuma AZ,4.0,,,,,,,Steve Webb,12/24/2014 18:00:00,Continued spread to the north and northeast.  Active smoldering throughout. ,Continued spread to the north and northeast.  Active smoldering throughout.,,,,,750.0,1536109.0,12/27/2014 12:00:00,,12/24/2014 1:00:00,,2014-12-24 18:00:00,N,,Burn out operations along Imperial Dam Road / CA S64 - Highway was closed by Law Enforcement during burn out operations.  Significant fire activity on north and northeast corner.  40-50' flame lengths  active fire spread to the north.,S,I,,100% perimeter mop up.,12/25/2014 17:48:43,SWCC,N,N,,Extremely dry fuels  low rh  variable wind speeds and direction
12512,,12/28/2014 12:00:00,Brady Shultz,12/26/2014 17:53:35,N,1536120.0,,Moderate,cwebb,12/26/2014 17:43:29,none,,,,,none,,,,,700.0,1536109.0,2015.0,A,12/23/2014 19:11:00,,1526350,50000.0,,,,,1535984.0,,,Salt Cedar  Arrowweed  Cat Tails,6328.0,2847991,Brady Shultz  AZ BLM  Colorado River District,,,Walker,001124,1536179.0,2847976,1536137.0,SIT209,12/26/2014 17:53:35,,1536224.0,JG8L,75.0,,50.0,Releasing (1) crew in am  retaining (1) crew and (2) type 6 engines.  Fire Boat will be back on the water patrolling.,,27.0,1527031.0,32.8555,,,,,,,,,-114.4456,15 miles north of Yuma AZ,4.0,,,,,,,Steve Webb,12/26/2014 18:00:00,Random torching with interior smoldering. ,Random torching with interior smoldering. ,,,,,1110.0,1536109.0,12/27/2014 12:00:00,,12/26/2014 8:00:00,,2014-12-26 18:00:00,N,,No active flames just smoldering - no significant events.,S,U,,100% perimeter mop up.,12/26/2014 17:53:35,SWCC,N,N,,Extremely dry fuels  northerly winds with very low temps.
12513,,12/27/2014 12:00:00,Gary Cook,12/25/2014 17:57:54,N,1536120.0,,Moderate,cwebb,12/25/2014 17:54:25,none,,,,,Powe lines to the north.  Highway / Primary Rd to the north and east.,,,,,300.0,1536109.0,2015.0,A,12/23/2014 19:11:00,,1526350,50000.0,,,,,1535984.0,,,Salt Cedar  Arrowweed  Cat Tails,6329.0,2848004,Gary Cook  AZ BLM  Colorado River District,,,Walker,001124,1536179.0,2847976,1536137.0,SIT209,12/25/2014 17:57:54,,1536224.0,JG8L,75.0,,50.0,Hold existing control lines and begin mop up.,,27.0,1527031.0,32.8555,,,,,,,,,-114.4456,15 miles north of Yuma AZ,4.0,,,,,,,Steve Webb,12/25/2014 18:00:00,Continued spread to the north and northeast.  Active smoldering throughout. ,Continued spread to the north and northeast.  Active smoldering throughout.,,,,,750.0,1536109.0,12/27/2014 12:00:00,,12/25/2014 1:00:00,,2014-12-25 18:00:00,N,,Interior burning increased in the afternoon.  Levee Road to the east had to be closed for a short time due to increased fire behavior.  This was to assure public and firefighter safety.,S,U,,100% perimeter mop up.,12/25/2014 17:57:54,SWCC,N,N,,Extremely dry fuels  low rh  variable wind speeds and direction
12514,,12/27/2014 12:00:00,Gary Cook,12/25/2014 18:13:05,N,1536120.0,,Moderate,wildcad,12/25/2014 17:58:10,none,,,,,Powe lines to the north.  Highway / Primary Rd to the north and east.,,,,,300.0,1536109.0,2015.0,A,12/23/2014 19:11:00,,1526350,50000.0,,,,,1535984.0,,,Salt Cedar  Arrowweed  Cat Tails,6330.0,2848017,Gary Cook  AZ BLM  Colorado River District,,,Walker,001124,1536179.0,2847976,1536137.0,SIT209,12/25/2014 18:13:05,,1536224.0,JG8L,75.0,,50.0,Hold existing control lines and begin mop up.,,27.0,1527031.0,32.8555,,,,,,,,,-114.4456,15 miles north of Yuma AZ,4.0,,,,,,,Steve Webb,12/25/2014 18:30:00,Continued spread to the north and northeast.  Active smoldering throughout. ,Continued spread to the north and northeast.  Active smoldering throughout.,,,,,750.0,1536109.0,12/27/2014 12:00:00,,12/25/2014 8:00:00,,2014-12-25 19:00:00,N,,Interior burning increased in the afternoon.  Levee Road to the east had to be closed for a short time due to increased fire behavior.  This was to assure public and firefighter safety.,S,U,,100% perimeter mop up.,12/25/2014 18:13:05,SWCC,N,N,,Extremely dry fuels  low rh  variable wind speeds and direction
12515,,12/28/2014 12:00:00,James Stewart,12/30/2014 16:42:29,N,1536117.0,,Low,rsandle,12/30/2014 16:32:20,none,,,,,none,,,,,1110.0,1536109.0,2015.0,A,12/23/2014 19:11:00,,1526350,50000.0,,,,,1535984.0,,,Salt Cedar  Arrow weed  Cat Tails,6331.0,2848030,James Stewart ICT4  AZ BLM  Colorado River District.  David Birtcher ICT4(T)  AZ State Forestry,,,Walker,001124,1536179.0,2847976,1536138.0,SIT209,12/30/2014 16:42:29,,1536224.0,JG8L,100.0,,0.0,Monitor,,27.0,1527031.0,32.8555,,,,,,,,,-114.4456,15 miles north of Yuma AZ,4.0,,,,,,,Bec Sandle,12/30/2014 18:00:00,Minimal interior smoldering. ,Minimal interior smoldering.,,,,,1110.0,1536109.0,12/27/2014 12:00:00,,12/28/2014 8:00:00,,2014-12-28 18:00:00,N,,No significant events today.,S,F,,,12/30/2014 16:42:29,SWCC,N,N,,
12516,,12/28/2014 12:00:00,Brady Shultz,12/26/2014 18:02:13,N,1536120.0,,Moderate,wildcad,12/26/2014 17:53:40,none,,,,,none,,,,,700.0,1536109.0,2015.0,A,12/23/2014 19:11:00,,1526350,50000.0,,,,,1535984.0,,,Salt Cedar  Arrowweed  Cat Tails,6332.0,2848045,Brady Shultz ICT4  AZ BLM  Colorado River District.  David Birtcher ICT4(T)  AZ State Forestry,,,Walker,001124,1536179.0,2847976,1536138.0,SIT209,12/26/2014 18:02:13,,1536224.0,JG8L,75.0,,50.0,Releasing (1) crew in am  retaining (1) crew and (2) type 6 engines.  Fire Boat will be back on the water patrolling.,,27.0,1527031.0,32.8555,,,,,,,,,-114.4456,15 miles north of Yuma AZ,4.0,,,,,,,Steve Webb,12/26/2014 18:30:00,Random torching with interior smoldering. ,Random torching with interior smoldering. ,,,,,1110.0,1536109.0,12/27/2014 12:00:00,,12/26/2014 8:15:00,,2014-12-26 19:00:00,N,,No active flames just smoldering - no significant events.,S,U,,100% perimeter mop up.,12/26/2014 18:02:13,SWCC,N,N,,Extremely dry fuels  northerly winds with very low temps.
12737,,04/20/2015 12:00:00,MIFC,04/20/2015 11:39:49,N,1536117.0,,,dnygaard,04/20/2015 11:37:11,,,,,,none,,,,,315.0,1536109.0,2015.0,A,04/13/2015 13:15:00,,1525834,15000.0,,,,,1535983.0,,,,6553.0,2845111,Kent Wolf  MNS,,,TANSEM FIRE - PARK RAPIDS AREA,161005,1536179.0,2845110,1536138.0,SIT209,04/20/2015 11:39:49,,,JM5F,100.0,,0.0,,Hawley,57.0,1525834.0,46.9222222,,,,,,,,,-95.0644444,8 miles E of Barnesville MN,27.0,,,,,,,Kent Wolf,04/20/2015 8:00:00,monitor,,,monitor,,15000.0,315.0,1536109.0,04/18/2015 12:00:00,,04/17/2015 8:00:00,,2015-04-20 08:00:00,N,,none,S,F,,,04/20/2015 11:39:49,EACC,N,N,,
12771,,,,,N,1536117.0,1535971.0,,Cretchless,07/30/2015 21:04:54,,,,,,,,,,,129.0,1536109.0,2015.0,D,07/19/2015 21:00:00,,1525224,0.0,,1536382.0,1536377.0,,1535990.0,,1536369.0,,6587.0,2844321,Leitch,,,PC Complex,100165,1536179.0,2844320,1536135.0,SIT209,07/30/2015 21:22:17,STEEP ROCKY TERRAIN WITH WETTING PRECIPITATION  DRIVING & BEES ,1536273.0,,0.0,,100.0,,WOODLAND,15.0,,45.9547222,,,,,,,,,-122.5361111,The complex consists of five fires in Cowlitz and Clark counties,53.0,,,,,,,,,,,,,,,,,,,07/20/2015 20:00:00,,2015-07-21 20:00:00,N,1535991.0,,C,I,,,,,N,N,,
13169,,03/14/2015 12:00:00,MARCO PEREA,03/16/2015 10:37:16,N,1536120.0,,TYPE 3,firecode,03/16/2015 10:35:34,NONE LISTED,NONE LISTED,NONE LISTED,NONE LISTED,NONE LISTED,NO THREAT INDICATED,NO THREAT INDICATED,NO THREAT INDICATED,NO THREAT INDICATED,NO THREAT INDICATED,733.5,1536109.0,2015.0,A,03/07/2015 18:23:00,,1525268,65000.0,,,,,1535983.0,,,MODEL 1 & 3 ROCKY STEEP TERRAIN,6985.0,2855740,IC JEFF CASEY  ND-SRA,,,TOWER,000022,1536179.0,2855739,1536137.0,SIT209,03/16/2015 10:37:16,NONE INDICATED,1536266.0,JJ42,100.0,,100.0,CURRENT PATROL/MONITOR ,,85.0,1526020.0,46.2608333,1536253.0,,,,,80W,16.0,132N,-100.6975,15 MILES NORTH OF FORT YATES ND,38.0,,,,,,,ANGIE HINKER,03/16/2015 9:30:00,WILL CONTINUE TO PATROL AND MONITOR THE FIRE FOR ANY ACTIVITY  CURRENTLY NO KNOWN FLAME OR HOT SPOTS.,PATROL AND MONITOR,PATROL AND MONITOR,PATROL AND MONITOR,PATROL AND MONITOR,65000.0,733.5,1536109.0,03/15/2015 12:00:00,NONE INDICATED,03/16/2015 10:00:00,,2015-03-16 10:30:00,N,,NO KNOWN FLAME OR HOT SPOTS  GIS TECH MAPPED THE FIRE AND OBTAINED A MORE ACCURATE SIZE (INCREASED).,S,F,CURRENT PATROL/MONITOR RESOURCES ADEQUATE   NO HOT SPOTS OR KNOWN FLAMES,PATROL AND MONITOR,03/16/2015 10:37:16,RMCC,N,N,,SOUTH WIND  GUSTING 20 MPH   TEMP 70  M RH 26%
13170,,03/14/2015 12:00:00,IC JEFF CASEY,03/14/2015 17:32:56,N,1536120.0,,TYPE 3,Wolcott$57,03/14/2015 17:21:26,NONE LISTED,NONE LISTED,NONE LISTED,NONE LISTED,NONE LISTED,NO THREAT INDICATED,NO THREAT INDICATED,NO THREAT INDICATED,NO THREAT INDICATED,NO THREAT INDICATED,733.5,1536109.0,2015.0,A,03/07/2015 18:23:00,,1525268,65000.0,,,,,1535983.0,,,MODEL 1 & 3 ROCKY STEEP TERRAIN,6986.0,2855748,IC JEFF CASEY  ND-SRA,,,TOWER,000022,1536179.0,2855739,1536137.0,SIT209,03/14/2015 17:32:56,NONE INDICATED,1536266.0,PAJJ57,100.0,,100.0,CURRENT PATROL/MONITOR ,,85.0,1526020.0,46.2608333,1536253.0,,,,,80W,16.0,132N,-100.6975,15 MILES NORTH OF FORT YATES ND,38.0,,,,,,,IC JEFF CASEY,03/14/2015 15:00:00,WILL CONTINUE TO PATROL AND MONITOR THE FIRE FOR ANY ACTIVITY  CURRENTLY NO KNOWN FLAME OR HOT SPOTS.,PATROL AND MONITOR,PATROL AND MONITOR,PATROL AND MONITOR,PATROL AND MONITOR,65000.0,733.5,1536109.0,03/15/2015 12:00:00,NONE INDICATED,03/13/2015 15:00:00,,2015-03-14 15:00:00,N,,NO KNOWN FLAME OR HOT SPOTS  GIS TECH MAPPED THE FIRE AND OBTAINED A MORE ACCURATE SIZE (INCREASED).,S,I,CURRENT PATROL/MONITOR RESOURCES ADEQUATE   NO HOT SPOTS OR KNOWN FLAMES,PATROL AND MONITOR,03/14/2015 17:32:56,GREAT PLAINS DISPATCH,N,N,,SOUTH WIND  GUSTING 20 MPH   TEMP 70  M RH 26%
13182,,03/14/2015 12:00:00,MARCO PEREA,03/16/2015 10:35:08,N,1536120.0,,TYPE 3,firecode,03/14/2015 17:33:19,NONE LISTED,NONE LISTED,NONE LISTED,NONE LISTED,NONE LISTED,NO THREAT INDICATED,NO THREAT INDICATED,NO THREAT INDICATED,NO THREAT INDICATED,NO THREAT INDICATED,733.5,1536109.0,2015.0,A,03/07/2015 18:23:00,,1525268,65000.0,,,,,1535983.0,,,MODEL 1 & 3 ROCKY STEEP TERRAIN,6998.0,2855756,IC JEFF CASEY  ND-SRA,,,TOWER,000022,1536179.0,2855739,1536137.0,SIT209,03/16/2015 10:35:08,NONE INDICATED,1536266.0,JJ42,100.0,,100.0,CURRENT PATROL/MONITOR ,,85.0,1526020.0,46.2608333,1536253.0,,,,,80W,16.0,132N,-100.6975,15 MILES NORTH OF FORT YATES ND,38.0,,,,,,,ANGIE HINKER,03/16/2015 9:30:00,WILL CONTINUE TO PATROL AND MONITOR THE FIRE FOR ANY ACTIVITY  CURRENTLY NO KNOWN FLAME OR HOT SPOTS.,PATROL AND MONITOR,PATROL AND MONITOR,PATROL AND MONITOR,PATROL AND MONITOR,65000.0,733.5,1536109.0,03/15/2015 12:00:00,THIS IS A DUPLICATE 209 INCIDENT WAS NOT ON PRA SEE THE ND-SRA 209 FOR CORRECT INFORMATION,03/16/2015 9:00:00,,2015-03-16 09:15:00,N,,NO KNOWN FLAME OR HOT SPOTS  GIS TECH MAPPED THE FIRE AND OBTAINED A MORE ACCURATE SIZE (INCREASED).,S,U,CURRENT PATROL/MONITOR RESOURCES ADEQUATE   NO HOT SPOTS OR KNOWN FLAMES,PATROL AND MONITOR,03/16/2015 10:35:08,RMCC,N,N,,SOUTH WIND  GUSTING 20 MPH   TEMP 70  M RH 26%
13197,,,,,N,1536120.0,,,khaninger,06/18/2015 21:59:58,,,,,,,,,,,3000.0,1536109.0,2015.0,D,02/06/2015 22:18:00,,1524926,,,,,,,,,,7013.0,2853928,Paul Melendrez (CAL FIRE) Rick Napoles   (USFS/BLM) ,,,ROUND,001662,1536179.0,2853927,,SIT209,06/18/2015 21:59:58,,1536273.0,,10.0,,100.0,,,39.0,,37.4536111,,,,,,,,,-119.58416670000001,,6.0,,,,,,,,,,,,,,,,,,,02/06/2015 20:00:00,,2015-02-07 08:00:00,N,,,S,I,,,,,N,Y,,
13240,,,D. Comingdeer - Cherokee Tribe,04/03/2015 10:40:39,N,1536117.0,,,Eoroscosr,04/03/2015 10:38:16,,,,,,None,,,,,275.0,1536109.0,2015.0,A,03/31/2015 14:00:00,,1525558,1500.0,,,,,1535989.0,,,,7056.0,2854471,D.Comingdeer,,,INDIAN HOUSE,015049,1536179.0,2854470,1536138.0,SIT209,04/03/2015 10:40:39,,,JLD8,100.0,,0.0,,,21.0,1525558.0,35.731944399999996,,,,,,,,,-95.0380556,".8 Miles NNW of Qualls, OK",40.0,,,,,,,Orosco - BIA/AOICC,04/03/2015 10:30:00,None on Trust,,,,,,,,,,03/31/2015 14:00:00,,2015-04-01 17:00:00,N,,Fire activity summary can be found on the OK States 209  of the same name.,S,F,,,04/03/2015 10:40:39,SACC,N,N,,
15280,,,WA-DNR Jordan Tsubuta,09/13/2015 21:14:59,N,1536117.0,1535970.0,,mteaford,09/13/2015 21:02:18,None at this time. Type 2 dozers could be a potential need in the future. ,,,,,The community of Wishram is directly threatened at this time. If the fire moves east past Wishram  other communities will be threatened. ,,,,,3200.0,1536109.0,2015.0,A,09/13/2015 14:22:00,,1525395,250000.0,,1536374.0,1536383.0,1536376.0,1535985.0,,1536368.0,Scattered timber is also involved. ,9096.0,2906443,Unified Command between DNR and Washington State Fire Marshall's Office,,,Horsethief Butte,000789,1536179.0,2906442,1536136.0,SIT209,09/15/2015 18:26:20,The community of Wishram is currently threatened and Level 3 evacuations are in place. Level 2 evacuations are being implemented east of Wishram. HWY 14 is closed at this time due to fire activity. ,,J3KC,15.0,,100.0,,,39.0,,45.650833299999995,,,,,,,,,-121.13694440000002,"4 miles west of Wishram, WA",53.0,,,,,,,Megan Kephart,09/13/2015 9:15:00,The fire is wind driven and will continue to move towards the east. Progression to the north and south is expected to remain minimal. ,,,,,,,,,,09/13/2015 14:00:00,,2015-09-13 19:00:00,N,1535983.0,,S,I,,Continue to construct dozer and hand line around the fire while providing for public and firefighter safety.  ,09/13/2015 21:14:59,OR-NWC,N,Y,,Red flag warnings for winds and low RH will persist into tomorrow and could continue to cause problems. 
15281,,,Brant Stanger,09/22/2015 19:55:42,N,1536117.0,1535968.0,,mteaford,09/22/2015 19:48:02,,,,,,none,,,,,3200.0,1536109.0,2015.0,A,09/13/2015 14:22:00,,1525395,250000.0,,,,,1535985.0,,1536370.0,,9097.0,2906460,none,,,Horsethief Butte,000789,1536179.0,2906442,1536139.0,SIT209,09/22/2015 19:55:42,,,J3KC,100.0,,100.0,,,39.0,,45.650833299999995,,,,,,,,,-121.13694440000002,"4 miles west of Wishram, WA",53.0,,,,,,,Megan Kephart,09/22/2015 19:00:00,none,,,,,,,,,The DNR and the Washington State Fire Marshall's Office decided on 9/16 that this fire actually started on the local fire district. This fire also went state mob and  the state mob type  team inputted a 209 for this incident. Refer to that 209 for all fin,09/16/2015 1:00:00,,2015-09-22 18:00:00,N,,,S,F,,done,09/22/2015 19:55:42,OR-NWC,N,Y,,
15335,,,,,N,1536117.0,1535968.0,,laurenbalisky,08/16/2015 12:24:00,Delegation  road closures on Pinkston Road  trigger points and evacuation plan  communications support  resources,Overhead  safety / law enforcement  4 strike teams  4 tenders  HEQB  air support  2 TFL / DIV  4 T2 H/C (minimum recommended is 8),,,,Residences  property  commercial structures  power lines  water tower (Kettle Falls)  operational continuity (rest),Same as above,Same as above,Same as above,,560.0,1536109.0,2015.0,D,08/14/2015 21:04:00,,1526822,,,,,,1535985.0,,,Overhead power lines  mines,9151.0,2904540,Local District,,,Gold Hill,001234,1536179.0,2904515,,SIT209,12/29/2015 12:47:49,High growth potential Structures / permanent threatened Life risk Smoke / health,1536273.0,,100.0,,100.0,3/4 Division,,65.0,1526822.0,48.63194439999999,1536107.0,,,NE,SW,38E,3.0,36N,-118.01583329999998,"1 Mile North of Kettle Falls, WA",53.0,25460.0,88549.0,11UMP,425460.0,5388549.0,11.0,,,Continued growth to the north  operational continuity (rest periods needed),Smoke from Marble Valley and Carpenter Road contributing to reduced or eliminated air capacity,,Up to 200 structures threatened if fire continues with current resource levels and unfilled resource orders,,,,,,,12/28/2015 12:00:00,,2015-12-29 12:00:00,N,1535983.0,,S,F,Camp  logistics  rehab  supplies 10k truck set,,,,N,N,,Lighting Winds
15424,,,"Mikal Barnett, ICT3",08/16/2015 12:52:50,N,1536118.0,1535971.0,,laurenbalisky,08/16/2015 12:24:00,Delegation  road closures on Pinkston Road  trigger points and evacuation plan  communications support  resources,Overhead  safety / law enforcement  4 strike teams  4 tenders  HEQB  air support  2 TFL / DIV  4 T2 H/C (minimum recommended is 8),,,,Residences  property  commercial structures  power lines  water tower (Kettle Falls)  operational continuity (rest),Same as above,Same as above,Same as above,,700.0,1536109.0,2015.0,A,08/14/2015 18:45:00,,1526822,37000.0,,1536380.0,1536373.0,,1535985.0,,1536369.0,Overhead power lines  mines,9240.0,2904516,Jeff Fuller  DNR 509-690-1781,,,Gold Hill,001234,1536179.0,2904515,,SIT209,08/26/2015 14:10:29,High growth potential Structures / permanent threatened Life risk Smoke / health,1536273.0,,0.0,,0.0,3/4 Division,Kettle Falls,65.0,1526822.0,48.6455556,1536107.0,,,NE,SW,38E,3.0,36N,-118.01194440000002,Pinkston Creek Road,53.0,25460.0,88549.0,11UMP,425460.0,5388549.0,11.0,"Norby Johnson, DIVS/OSC",08/15/2015 21:00:00,Continued growth to the north  operational continuity (rest periods needed),Smoke from Marble Valley and Carpenter Road contributing to reduced or eliminated air capacity,,Up to 200 structures threatened if fire continues with current resource levels and unfilled resource orders,,,,,,,08/14/2015 18:45:00,,2015-08-16 01:45:00,N,1535983.0,,S,I,Camp  logistics  rehab  supplies 10k truck set,,08/16/2015 12:52:50,WA-NEC,N,N,,Lighting Winds
16880,,,JOE MILES,09/16/2015 8:39:37,N,1536118.0,1535968.0,,mbond,09/16/2015 8:27:57,NONE AT THIS TIME,SAME,SAME,SAME,SAME,NONE,SAME,SAME,SAME,SAME,106.0,1536109.0,2015.0,A,09/10/2015 13:30:00,,1525875,1800.0,,1536378.0,,,1535987.0,,1536368.0,,10696.0,2943612,J LETT,,,Tater Creek Fire,SED011,1536179.0,2943611,1536138.0,SIT209,09/16/2015 8:39:37,,1536266.0,,0.0,,100.0,NONE AT THIS TIME,"LUMBERTON, MS",35.0,1527327.0,31.045555600000004,,,,,,,,,-89.3086111,"10 MILES NE OF LUMBERTON, MS",28.0,,,,,,,MARY BOND,09/16/2015 8:30:00,NONE,SAME,SAME,SAME,SAME,1800.0,106.0,1536109.0,,,09/10/2015 13:30:00,,2015-09-14 14:45:00,N,,,S,F,,FIRE IS CONTROLLED,09/16/2015 8:39:37,SACC,N,N,,TIMBER (GRASS AND UNDERSTORY)
16945,,10/18/2015 12:00:00,EOR DO,10/21/2015 10:32:53,N,1536117.0,1535968.0,,Eoroscosr,10/21/2015 10:31:10,,,,,,None,,,,,100.0,1536109.0,2015.0,A,10/17/2015 16:29:00,,1526100,1500.0,,,,,1535981.0,,1536370.0,,10761.0,2948513,Unknown,,,Mule Pasture,000337,1536179.0,2948512,1536139.0,SIT209,10/21/2015 10:32:53,,,J4NJ,100.0,,100.0,,,61.0,1526100.0,35.3086111,,,,,,,,,-94.9547222,Unknown,40.0,,,,,,,Orosco - BIA/AOICC,10/21/2015 10:30:00,None,,,,,,,,,,10/17/2015 16:30:00,,2015-10-19 17:00:00,N,,,S,F,,,10/21/2015 10:32:53,SACC,N,N,,
16984,,10/17/2015 12:00:00,HEATHER GRIFFIN,10/27/2015 9:04:29,N,1536120.0,1535968.0,,mascher,10/27/2015 8:57:56,,,,,,NO SIGNIFICANT THREAT,,,,,194.0,1536109.0,2015.0,A,10/17/2015 12:45:00,,1524628,3327.12,,,,,1535987.0,,1536369.0,,10800.0,2948796,JEFF ANDERS,,,STATE LINE,1500011,1536179.0,2948795,,SIT209,10/27/2015 9:04:29,,1536266.0,,0.0,,100.0,,,13.0,1524628.0,32.768055600000004,,,,,,,,,-94.03,SOUTH OS HWY 2,22.0,,,,,,,JEFF ANDERS,10/23/2015 13:00:00,FIRE CONTAINED  NO PREDICTED THREAT.,,,,,,,,,,10/17/2015 12:45:00,,2015-10-17 19:30:00,N,,,S,F,,,10/27/2015 9:04:29,LA-KIF,N,N,,
17400,,08/01/2015 12:00:00,Micheal Butteri,01/06/2016 11:15:04,N,2990064.0,2989914.0,Unstaffed,hnshook,12/29/2015 17:56:15,None,None,None,None,None,No current or anticipated threats. ,No current or anticipated threats. ,No current or anticipated threats. ,No current or anticipated threats. ,No current or anticipated threats. ,16703.5,2990055.0,2016.0,A,06/23/2015 15:09:00,,2979671,2000.0,,,,,2989928.0,,2990316.0,,9.0,4249386,Tanana Zone - AFS,,,Sulukna,000573,2990125.0,4249385,,SIT209,01/06/2016 11:15:04,No known safety and health risks at this time. ,2990113.0,JT3G,0.0,,0.0,Monitor and conduct surveillance to assess values at risk as appropriate. ,,290.0,2977894.0,64.0666667,2990023.0,,,SE,SW,24E,28.0,16S,-154.1333333,"42 miles west of Poorman, confluence of Nowitna and Sulukna Rivers.",2.0,44700.0,4934.0,5WMM,444700.0,7104934.0,5.0,Hilary Shook,12/29/2015 18:00:00,Minimal activity anticipated based on observations and forecasted cooler  wetter weather.  ,Same,Same ,same,same,2000.0,,,,No fire spread has been detected since last report on 7/17.  Some minor smoke  mostly interior  was observed.   Block 45:  Estimated costs reflect the fires proportionate share of surveillance flight times. ,07/28/2015 03:00:00,,2015-12-29 02:45:00,N,,,S,F,The monitoring strategy is appropriate for this Limited Management Option fire given its location  current and expected behavior and limited values at risk.,Monitor fire spread and activity of a Limited Management Option fire allowing it to play its natural role where resources at risk values are low. ,01/06/2016 11:15:04,AK-ACC,N,N,,07/27  AKZ-216; LOWER KOYUKUK AND MIDDLE YUKON VALLEYS Isolated thunderstorms today  tonight and tomorrow Today: 20% ch precip  temp 63-73(+1)  RH 35-50(-11)  winds NW 4-8  CWR 0   LAL 2 Tonight: 20% ch precip  temp 44-54(-7)  RH 77-92(0)  winds NW 4-8  C
17401,,,"Mike Butteri, FMO-TAD",08/01/2015 21:27:04,N,2990064.0,2989914.0,Unstaffed,kellett,07/27/2015 21:28:16,None,None,None,None,None,No current or anticipated threats. ,,,,,16466.8,2990055.0,2016.0,A,06/23/2015 15:09:00,,2979671,2000.0,,,,,2989928.0,,2990316.0,,10.0,4249394,Tanana Zone - AFS,,,Sulukna,000573,2990125.0,4249385,,SIT209,08/01/2015 21:27:04,No known safety and health risks at this time. ,2990113.0,JT3G,0.0,,0.0,Monitor and conduct surveillance to assess values at risk as appropriate. ,,290.0,2977894.0,64.0666667,2990023.0,,,SE,SW,24E,28.0,16S,-154.1333333,"42 miles west of Poorman, confluence of Nowitna and Sulukna Rivers.",2.0,44700.0,4934.0,5WMM,444700.0,7104934.0,5.0,Kent Ellett - SITL,07/27/2015 22:45:00,Minimal activity anticipated based on observations and forecasted cooler  wetter weather.  ,Same,Same ,,,,,,,No fire spread has been detected since last report on 7/17.  Some minor smoke  mostly interior  was observed.   Block 45:  Estimated costs reflect the fires proportionate share of surveillance flight times. ,07/18/2015 01:00:00,,2015-07-27 23:00:00,N,,Some smoke observed  mostly interior. ,S,U,The monitoring strategy is appropriate for this Limited Management Option fire given its location  current and expected behavior and limited values at risk.,Monitor fire spread and activity of a Limited Management Option fire allowing it to play its natural role where resources at risk values are low. ,08/01/2015 21:27:04,AICC,N,N,,07/27  AKZ-216; LOWER KOYUKUK AND MIDDLE YUKON VALLEYS Isolated thunderstorms today  tonight and tomorrow Today: 20% ch precip  temp 63-73(+1)  RH 35-50(-11)  winds NW 4-8  CWR 0   LAL 2 Tonight: 20% ch precip  temp 44-54(-7)  RH 77-92(0)  winds NW 4-8  C
17408,,,Mike Butteri - FMO-TAD,07/18/2015 00:41:11,N,2990064.0,2989914.0,,kellett,07/18/2015 00:29:20,None,None,None,None,None,No current or anticipated threats. ,,,,,16466.8,2990055.0,2016.0,A,06/23/2015 15:09:00,,2979671,3000.0,,2990324.0,,,2989928.0,,2990316.0,"Mix of black spruce  ""hardwoods"" and tundra. ",17.0,4249402,Tanana Zone - AFS,,,Sulukna,000573,2990125.0,4249385,,SIT209,07/18/2015 00:41:11,No known safety and health risks at this time. ,2990113.0,JT3G,0.0,,0.0,Monitor and conduct surveillance as elvaluate values at risk as appropriate. ,,290.0,2977894.0,64.0666667,2990023.0,,,SE,SW,24E,28.0,16S,-154.1333333,"42 miles west of Poorman, confluence of Nowitna and Sulukna Rivers.",2.0,44700.0,4934.0,5WMM,444700.0,7104934.0,5.0,Kent Ellett - SITL,07/17/2015 23:00:00,Minimal activity anticipated based on observations and forecasted cooler  wetter weather.  ,Same,Same ,,,,,,,This fire has nearly merged with the Sea #367 Fire.  The Sulukna Fire is on the west side of Sulukna River and the Sea fire is on the east side of the river. ,06/23/2015 21:00:00,,2015-07-17 23:00:00,N,2989927.0,Minimal growth and activity along the perimeter. ,S,I,The monitoring strategy is appropriate for this Limited Management Option fire given its location  current and expectd behavior and limited values at risk.,Monitor fire spread and activity of a Limited Management Option fire allowing it to play its natural role where resources at risk values are low. ,07/18/2015 00:41:11,AICC,N,N,,Isolated thunderstorms today-tonight. Today: 90% t-storms  temp 53-63(-12)  RH 40+(+27)  Winds SE 9-13  LAL 2  CWR 20% Tonight: 90% t-storms  temp 43-53(0)  RH 88-100(+4)  20ft Winds SW 9-13 G 20%  LAL 2. CWR 30% 07/18: 80% showers  temp 51-61  RH 40+  Wi
17587,,,,,N,2990063.0,,4,SIT209,01/27/2014 16:29:02,,,,,,,,,,,143.0,2990055.0,2016.0,D,01/23/2014 17:00:00,,2980635,,,,,,,,,,196.0,4245827,D. Price - ODF G. Novak - Industry,,,Alder Creek,14OR-711S-030914,2990125.0,4245826,2990084.0,SIT209,01/27/2014 16:29:02,,,,100.0,,100.0,,,,,,,,,,,,,,,,,,,,,,,,,,,,,,,,,,,01/23/2014 17:00:00,,2014-01-27 19:00:00,N,,,S,F,,,,,N,N,,
17708,2989935.0,02/12/2016 12:00:00,R. Smith - BIA Forestry Tech.,02/15/2016 11:52:54,N,2990063.0,2989915.0,,Eoroscosr,02/15/2016 11:50:31,,,,,,None,,,,,326.0,2990055.0,2016.0,A,02/08/2016 14:00:00,,2979908,15000.0,,,,,2989929.0,,2990316.0,,317.0,4259619,Strother FD,,,NO WAY,016011,2990125.0,4259618,2990084.0,SIT209,02/15/2016 11:52:54,,,J5X9,100.0,,100.0,,,133.0,2979432.0,35.3475,,,,,,,,,-96.5636111,"6 Miles W. of Cromwell, OK",40.0,,,,,,,BIA/AOICC,02/15/2016 11:00:00,None,,,,,,,,,,02/08/2016 14:00:00,,2016-02-14 18:00:00,N,2989927.0,,S,F,,,02/15/2016 11:52:54,SACC,N,N,,
18717,,07/15/2016 12:00:00,,,,2990066.0,2989917.0,,,,Critical needs: Two Type 1 Helicopters; One Type 2 helicopter; Six federal Type 1 crews; One Type 3 helicopter are needed to meet incident objectives.  8 SFOR for line safety,,,,,Road closure is in effect for the Grade Valley Road at the intersection of Lockwood Valley Road and the Pine Mountain Road at Highway 33.      Trail systems connecting Pine Mountain to Piedra Blanca area remain closed.  Voluntary evacuations of the Camp S,Road closure is in effect for the Grade Valley Road at the intersection of Lockwood Valley Road and the Pine Mountain Road at Highway 33.      Trail systems connecting Pine Mountain to Piedra Blanca area remain closed.  Voluntary evacuations of the Camp S,,,,1590.0,2990055.0,,A,,,2977927,2800000.0,,,,,2989930.0,1.0,,Rolling material coupled with southerly winds continues to dominate fires spread in steep inaccessible terrain  allowing for fires spread.   High potential for growth is attributed to continuous heavy flashy fuels topographic alignment with fires spread. ,1326.0,4268827,Deron Mills SCSIIMT,,,,,,4268784,,,,Camp Scheideck community and nearby residences and ranches.,,,0.0,,,,"Frazier Park, CA",,,34.6308333,,,,,,22W,5.0,6N,-119.2302778,Eleven miles north of Ojai in the Sespe wilderness.,6.0,,,,,,,,,Strong southerly winds will continue increase acreage as the Fire burn to the north and northeast. Roll out is still a contributing factor to fire spread.,Strong southerly winds will continue increase acreage as the Fire burn to the north and northeast. Roll out is still a contributing factor to fire spread..,,,,,,2990055.0,07/15/2016 12:00:00,,07/02/2016 20:00:00,,2016-07-03 08:00:00,,,,,U,,,,,,,,AN UPPER LEVEL TROUGH OF LOW PRESSURE AND DRY  SOUTHWEST WINDS ALOFT WILL PREVAIL OVER THE AREA THROUGH  NEXT WEEK THURSDAY. A RELATIVELY DEEP MARINE LAYER IS EXPECTED  TO PERSIST NEAR SHORE AS A MODERATE ONSHORE PRESSURE GRADIENT  DEVELOPS EACH AFTERNOON
18729,,07/15/2016 12:00:00,D. Mills,07/04/2016 19:58:00,,2990066.0,2989917.0,,mlemon,,,,,,,Road closure remains in effect for the Grade Valley Road at the intersection of Lockwood Valley Road and the Pine Mountain Road at Highway 33.      Trail systems connecting Pine Mountain to Piedra Blanca area remain closed.  Voluntary evacuations of the C,,,,,1634.0,2990055.0,,A,06/30/2016 10:54:00,,2977927,4100000.0,,,,,2989930.0,1.0,,Rolling material on the southern flank of the fire continues to dominate suppression efforts in steep inaccessible terrain along Pine Mnt. Ridge.   Potential for growth is attributed to continuous heavy fuels and topographic alignment throughout the fire.,1338.0,4269053,Deron Mills SCSIIMT,,,,,2990125.0,4268784,2990081.0,,,Camp Scheideck community and nearby residences and ranches.,,KC28,15.0,,,,"Frazier Park, CA",111.0,,34.6308333,,,,,,22W,5.0,6N,-119.2302778,Eleven miles north of Ojai in the Sespe wilderness.,6.0,,,,,,,Mark Lemon,07/04/2016 20:00:00,8-16 mph ridge winds are predicted to shift to the westnorthwest later this afternoon.  This wind shift could move the fire into fresh un-burned fuels.  Roll out is still a contributing factor to fire spread. ,Northwest winds  Ridge top and slope are predicted to continue.  Roll out is still a contributing factor to fire spread. ,Northwest winds  Ridge top and slope are predicted to continue.  Roll out is still a contributing factor to fire spread. ,,,,,2990055.0,07/15/2016 12:00:00,,07/04/2016 08:00:00,,2016-07-04 20:00:00,,,Fire was moderately active today. With most of the activity on the north facing slopes on Divisions A and Z. Ground fire with occasional uphill runs was observed,,U,,,07/04/2016 19:58:00,SOPS,,,,AN UPPER LEVEL TROUGH OF LOW PRESSURE AND DRY  SOUTHWEST WINDS ALOFT WILL PREVAIL OVER THE AREA THROUGH  THURSDAY. THE TROUGH OF LOW PRESSURE IS EXPECTED TO SHIFT  EAST FRIDAY WHILE HIGH PRESSURE SHIFTS NORTH OVER THE AREA.  A RELATIVELY DEEP MARINE LAYER
18730,,07/17/2016 12:00:00,G. Helming,,,2990066.0,2989917.0,,,,,,,,,A fire closure is proposed for the area immediately surrounding the fire. This area would be bounded by Reyes Creek on the east from the head waters to the confluence at Alamo Creek on the south.  Along Alamo to the east to the head waters in section 26  ,A fire closure is proposed for the area immediately surrounding the fire. This area would be bounded by Reyes Creek on the east from the head waters to the confluence at Alamo Creek on the south.  Along Alamo to the east to the head waters in section 26  ,Soft road closure remains in effect for the Grade Valley Road at the intersection of Lockwood Valley Road and the Pine Mountain Road at Highway 33.  ,,,2304.0,2990055.0,,A,,,2977927,15200000.0,,,,,2989930.0,,,No reported fire growth today.  ,1339.0,4269692,Gary Helming ICT3 Peter Stephenson ICT3(T),,,,,,4268784,2990082.0,,,Camp Scheideck community and nearby residences and ranches.,,KC28,93.0,,100.0,,"Frazier Park, CA",111.0,,34.63,,,,,,22W,5.0,6N,-119.2236111,Eleven miles north of Ojai in the Sespe wilderness.,6.0,,,,,,,J. Jasberg,07/14/2016 20:00:00,Low humidity continues.  Crews will continue to mop-up and reinforce fireline where necessary.   ,Possible interior activity continues with predicted north wind and low humidity.  Crews will continue to mop-up and reinforce fireline where necessary.     ,Warming and drying trend predicted. ,,,,,2990055.0,07/11/2016 12:00:00,,07/14/2016 20:00:00,,2016-07-15 08:00:00,,,,S,U,Large scale demob of resources will continue. Mop-up continued along Pine Mountain Ridge to Cedar Creek Trail.  Mop-up continues along the  fireline in Divisions M and I.  Crews in Divisions A/D/S and Z hold and improve the lines and monitored inaccessibl,,07/14/2016 20:03:51,SOPS,,,,High pressure along the Arizona Mexico border will remain stationary through Friday keeping inland areas sunny and warm. Temperatures each day will peak in the 90's across interior valleys and mountains. Some of the hottest areas will see relative humidit
18748,,07/15/2016 12:00:00,,,,2990066.0,2989917.0,,,,,,,,,Road closure remains in effect for the Grade Valley Road at the intersection of Lockwood Valley Road and the Pine Mountain Road at Highway 33.      Trail systems connecting Pine Mountain to Piedra Blanca area remain closed.  Voluntary evacuations of the C,,,,,2058.0,2990055.0,,A,,1.0,2977927,6300000.0,,,,,2989930.0,1.0,,Rolling material on the continues to contribute to fires spread.  Potential for growth is attributed to continuous heavy fuels and topographic alignment throughout the fire.  Fire continues to burn under dry conditions consuming ground fuels and litter. B,1357.0,4269097,Deron Mills SCSIIMT,,,,,,4268784,,,,Camp Scheideck community and nearby residences and ranches.,,KC28,18.0,,,,"Frazier Park, CA",,,34.6308333,,,,,,22W,5.0,6N,-119.2302778,Eleven miles north of Ojai in the Sespe wilderness.,6.0,,,,,,,,,Fire growth continues at about 200 ac a day. with most of the movement to the north and west. Predicted 6-12 mph north and west surface winds continued through the night. These winds are to continue throughout the day.  The fire has been observed activly ,Northwest winds  Ridge top and slope are predicted to continue.  Roll out is still a contributing factor to fire spread. ,Northwest winds  Ridge top and slope are predicted to continue.  Roll out is still a contributing factor to fire spread. ,,,,,2990055.0,,,07/05/2016 20:00:00,,2016-07-06 08:00:00,,,Fire was moderately active through the night. With most of the activity on the north end of the fire in Division I and some movement in Division D. Ground fire with occasional uphill runs was observed in other areas of the fire that have active fire.,,U,,,,SOPS,,,, AN UPPER LEVEL TROUGH OF LOW PRESSURE AND DRY  SOUTHWEST WINDS ALOFT WILL PREVAIL OVER THE AREA THROUGH  THURSDAY. THE TROUGH OF LOW PRESSURE IS EXPECTED TO SHIFT  EAST FRIDAY WHILE HIGH PRESSURE SHIFTS NORTH OVER THE AREA.  A TROUGH OF LOW PRESSURE IS T
18749,,07/17/2016 12:00:00,Peter Stephenson,,,2990066.0,2989917.0,,,,,,,,,A fire closure is proposed for the area immediately surrounding the fire. This area would be bounded by Reyes Creek on the east from the head waters to the confluence at Alamo Creek on the south.  Along Alamo to the east to the head waters in section 26  ,A fire closure is proposed for the area immediately surrounding the fire. This area would be bounded by Reyes Creek on the east from the head waters to the confluence at Alamo Creek on the south.  Along Alamo to the east to the head waters in section 26  ,Soft road closure remains in effect for the Grade Valley Road at the intersection of Lockwood Valley Road and the Pine Mountain Road at Highway 33.  ,,,2304.0,2990055.0,,A,,,2977927,15000000.0,,,,,2989930.0,,,No reported fire growth today.  ,1358.0,4269716,Gary Helming ICT3 Peter Stephenson ICT3(T),,,,,,4268784,,,,Camp Scheideck community and nearby residences and ranches.,,KC28,93.0,,,,"Frazier Park, CA",,,34.63,,,,,,22W,5.0,6N,-119.2236111,Eleven miles north of Ojai in the Sespe wilderness.,6.0,,,,,,,Peter Stephenson,07/13/2016 18:30:00,Low humidity continues.  Crews will continue to mop-up and reinforce fireline where necessary.   ,Possible interior activity continues with predicted north wind and low humidity.  Crews will continue to mop-up and reinforce fireline where necessary.     ,Warming and drying trend predicted. ,,,,,2990055.0,07/11/2016 12:00:00,,07/13/2016 08:00:00,,2016-07-13 20:00:00,Y,,,S,U,Large scale demob of resources will continue. Mop-up continued along Pine Mountain Ridge to Cedar Creek Trail.  Mop-up continues along the  fireline in Divisions M and I.  Crews in Divisions A/D/S and Z hold and improve the lines and monitored inaccessibl,,07/13/2016 19:07:47,sops,,,,A WARMING TREND IS EXPECTED FOR INLAND AREAS THROUGH THURSDAY AS UPPER LEVEL HIGH PRESSURE OVER NORTHERN MEXICO EXPANDS NORTHWESTWARD. VERY DRY CONDITIONS WILL CONTINUE FOR INTERIOR AREAS THIS WEEK...WITH MINIMUM HUMIDITIES IN THE TEENS AND SINGLE DIGITS 
18750,2989936.0,07/07/2016 12:00:00,John Abel,06/30/2016 20:13:04,Y,2990066.0,2989916.0,,mlhanley,06/30/2016 19:39:13,Type 1 Hotshots Crews  Type II Helicopters for troop shuttle will be a necessity ,,,,,Voluntary evacuations of the Camp Scheideck community  Reyes Creek Campground  the Grade Valley area including Thorne Meadow and Fish Bowls.  Trail systems connecting to the Pine Mountain to Piedra Blanca area are closed,,,,,100.0,2990055.0,2016.0,A,06/30/2016 10:54:00,,2977927,200000.0,,2990319.0,2990324.0,2990331.0,2989930.0,,2990315.0,,1359.0,4269739,DIV7 Abell,,,Pine,001986,2990125.0,4268784,2990083.0,SIT209,06/30/2016 20:13:04,,,KC28,0.0,,0.0,Insert crews to start handline construction and continue to slow forward progress of the fire with aerial resources,Lockwood Valley,111.0,2977927.0,34.6308333,,,,,,,,,-119.2302778,East of Reyes Peak,6.0,,,,,,,Maeve Juarez,06/30/2016 18:00:00,Fire will continue to burn to the northeast  free burning  no containment due to no access and topography,,,,,1000000.0,1500.0,2990055.0,07/07/2016 12:00:00,,06/30/2016 17:00:00,,2016-07-01 06:00:00,Y,2989931.0,Fire exhibited short to moderate range spotting in receptive fuels.  Due to accessibility issues  terrain and wilderness crews were not able to make access to the fire.,S,I,Inaccessible terrain to fire inside the Sespe Wilderness,Maintain fire in the smallest footprint possible within the Sespe Wilderness,06/30/2016 20:13:04,OSCC,Y,N,,A warm and dry air mass will continue across the fire area through Friday.  Humidity's will fall into the teens with poor overnight recovery.  On shore flow late this afternoon will transition to weak North West to North tonight.
18763,,07/15/2016 12:00:00,D. Mills,07/04/2016 20:25:48,,2990066.0,2989917.0,,,,,,,,,Road closure remains in effect for the Grade Valley Road at the intersection of Lockwood Valley Road and the Pine Mountain Road at Highway 33.      Trail systems connecting Pine Mountain to Piedra Blanca area remain closed.  Voluntary evacuations of the C,,,,,1660.0,2990055.0,,A,06/30/2016 10:54:00,1.0,2977927,4100000.0,,,,,2989930.0,1.0,,Rolling material on the southern flank of the fire continues to dominate suppression efforts in steep inaccessible terrain along Pine Mnt. Ridge.   Potential for growth is attributed to continuous heavy fuels and topographic alignment throughout the fire.,1372.0,4269141,Deron Mills SCSIIMT,,,,,2990125.0,4268784,2990081.0,,,Camp Scheideck community and nearby residences and ranches.,,KC28,15.0,,100.0,,"Frazier Park, CA",111.0,,34.6308333,,,,,,22W,5.0,6N,-119.2302778,Eleven miles north of Ojai in the Sespe wilderness.,6.0,,,,,,,Mark Lemon,07/04/2016 20:30:00,8-16 mph ridge winds are predicted to shift to the westnorthwest later this afternoon.  This wind shift could move the fire into fresh un-burned fuels.  Roll out is still a contributing factor to fire spread. ,Northwest winds  Ridge top and slope are predicted to continue.  Roll out is still a contributing factor to fire spread. ,Northwest winds  Ridge top and slope are predicted to continue.  Roll out is still a contributing factor to fire spread. ,,,,,2990055.0,07/15/2016 12:00:00,,07/04/2016 20:00:00,,2016-07-04 20:30:00,,,Fire was moderately active today. With most of the activity on the north facing slopes on Divisions A and Z.  Ground fire with occasional uphill runs was observed ,,U,,,07/04/2016 20:25:48,SOPS,,,,AN UPPER LEVEL TROUGH OF LOW PRESSURE AND DRY  SOUTHWEST WINDS ALOFT WILL PREVAIL OVER THE AREA THROUGH  THURSDAY. THE TROUGH OF LOW PRESSURE IS EXPECTED TO SHIFT  EAST FRIDAY WHILE HIGH PRESSURE SHIFTS NORTH OVER THE AREA.  A RELATIVELY DEEP MARINE LAYER
18764,2989936.0,07/07/2016 12:00:00,Linda Lowe,07/01/2016 10:05:12,Y,2990066.0,2989917.0,Type II Team Mills In Route. In-brief 7/1/16 1000.,llowe,07/01/2016 09:33:43,Type 1 Hotshots Crews  Type II Helicopters for troop shuttle will be a necessity ,,,,,Voluntary evacuations of the Camp Scheideck community  Reyes Creek Campground  the Grade Valley area including Thorne Meadow and Fish Bowls.  Trail systems connecting to the Pine Mountain to Piedra Blanca area are closed,,,,,300.0,2990055.0,2016.0,A,06/30/2016 10:54:00,,2977927,0.0,,2990329.0,2990321.0,,2989930.0,,2990314.0,,1373.0,4269767,Gary Helming ICT3 Pete Stephenson ICT3 Trainee,,,Pine,001986,2990125.0,4268784,2990083.0,SIT209,07/01/2016 10:05:12,,2990219.0,KC28,0.0,,0.0,Insert crews to start handline construction and continue to slow forward progress of the fire with aerial resources,"Frazier Park, CA",111.0,2977927.0,34.6308333,2990041.0,,,,,22W,5.0,6N,-119.2302778,East of Reyes Peak,6.0,,,,,,,Linda Lowe,07/01/2016 09:00:00,Fire will continue to burn to the northeast  free burning  no containment due to no access and topography,,,,,1000000.0,1500.0,2990055.0,07/07/2016 12:00:00,Air transport to fireline is primary.  Extended exposure due to hike time to fire.,07/01/2016 09:00:00,,2016-07-01 20:00:00,Y,2989931.0,High potential for growth  heavy fuels  challenge with access  steep terrain  low RH.,S,U,Inaccessible terrain to fire inside the Sespe Wilderness. Mgmt. Objectives: Provide for firefighter and public safety  Minimize firefighter exposure to extreme terrain  exercise Minimum impact suppression tactics (MIST),Maintain fire in the smallest footprint possible within the Sespe Wilderness,07/01/2016 10:05:12,OSC,Y,N,,A warm and dry air mass will continue across the fire area through Friday.  Humidity's will fall into the teens with poor overnight recovery. Slope SE Winds 4-8 am  south 5-10 gust to 15 afternoon  Ridge SE 5-10 am  S 6-12 gust to 18pm
18765,,07/07/2016 12:00:00,,,,2990066.0,2989917.0,,,,Critical needs: Six federal Type 1 crews; One Type 3 helicopter are needed to meet incident objectives.,Critical needs: Six federal Type 1 crews; One Type 3 helicopter are needed to meet incident objectives.,,,,Voluntary evacuations of the Camp Scheideck community  Reyes Creek Campground  the Grade Valley area including Thorne Meadow and Fish Bowls.  Trail systems connecting to the Pine Mountain to Piedra Blanca area are closed,Voluntary evacuations of the Camp Scheideck community  Reyes Creek Campground  the Grade Valley area including Thorne Meadow and Fish Bowls.  Trail systems connecting to the Pine Mountain to Piedra Blanca area are closed,Voluntary evacuations of the Camp Scheideck community  Reyes Creek Campground  the Grade Valley area including Thorne Meadow and Fish Bowls. Trail systems connecting to the Pine Mountain to Piedra Blanca area are closed.,,,400.0,2990055.0,,A,,1.0,2977927,1500000.0,,,,,2989930.0,,,,1374.0,4269788,Darren Mills CC-IMT,,,,,,4268784,,,,Camp Scheideck community and nearby residences and ranches.,,KC28,0.0,,,,"Frazier Park, CA",,,34.63094,,,,,,22W,5.0,6N,-119.2303,Eleven miles north of Ojai in the Sespe wilderness,6.0,,,,,,,Peter Stephenson ICT3(T),07/01/2016 20:30:00,Fire will continue to burn to the northeast and rollout to the Southwest will increase acreage. ,Fire will continue to burn to the northeast  and rollout to the Southwest will increase acreage. ,,,,,1500.0,2990055.0,07/07/2016 12:00:00,,07/01/2016 20:00:00,,2016-07-01 20:30:00,,,High potential for growth  heavy fuels  challenge with steep terrain.  Fire continues to burn to Northeast.  Acreage increase in the Southwest due to roll-out.,,U,,,07/01/2016 20:12:00,,,,,A warm and dry air mass will continue across the fire area through Friday.  Humidity's will fall into the teens with poor overnight recovery. Slope SE Winds 4-8 in the morning  south 5-10 gust to 15 in the  afternoon  Ridge SE 5-10 in the morning  S 6-12 
18782,,07/15/2016 12:00:00,Deron Mills ICT2,07/09/2016 19:28:39,,2990066.0,2989917.0,,acolson,,,,,,,Road closure remains in effect for the Grade Valley Road at the intersection of Lockwood Valley Road and the Pine Mountain Road at Highway 33.      Trail systems connecting Pine Mountain to Piedra Blanca area remain closed.  Voluntary evacuations of the C,Road closure remains in effect for the Grade Valley Road at the intersection of Lockwood Valley Road and the Pine Mountain Road at Highway 33.      Trail systems connecting Pine Mountain to Piedra Blanca area remain closed.  Voluntary evacuations of the C,,,,2304.0,2990055.0,,A,06/30/2016 10:54:00,1.0,2977927,12300000.0,,,,,2989930.0,1.0,,Potential for growth is attributed to continuous heavy fuels and topographic alignment throughout the fire.  Fire growth has slowed a lot.  Fire continues to burn due to dry conditions consuming ground fuels and litter.  ,1391.0,4269186,Deron Mills SCSIIMT,,,,,2990125.0,4268784,2990081.0,SIT209,,Camp Scheideck community and nearby residences and ranches.,,KC28,71.0,,,,"Frazier Park, CA",111.0,,34.63,,,,,,22W,5.0,6N,-119.22366670000001,Eleven miles north of Ojai in the Sespe wilderness.,6.0,,,,,,,Artie Colson PSC2,07/09/2016 19:15:00,Although slowing considerably  minimal fire growth in Divisions I and M.  Predicted 6-18 mph north and west surface winds continued to buffer the fire. These winds are to continue throughout Saturday then begin to pick up in the evening.   Northwest winds,Northwest winds  Ridge top and slope are predicted to potentially increase more on Sunday  gusting to 40 MPH.  Roll out is still a contributing factor to fire spread. ,Warming and drying trend predicted. ,,,,,2990055.0,07/11/2016 12:00:00,,07/09/2016 08:00:00,,2016-07-09 20:00:00,,,,,U,,,07/09/2016 19:28:39,SOPS,,,,DISCUSSION: A TROUGH OF LOW PRESSURE WILL MOVE THROUGH THE AREA TONIGHT BRINGING AN INCREASE IN WEST TO NORTHWEST WINDS FOR WESTERN PORTIONS OF THE SANTA YNEZ RANGE  THE I-5 CORRIDOR  AND THE ANTELOPE VALLEY. WEST TO NORTHWEST WINDS IN THESE AREAS WILL GU
18783,,07/07/2016 12:00:00,,,,2990066.0,2989917.0,,,,Critical needs: Six federal Type 1 crews; One Type 3 helicopter are needed to meet incident objectives.,Critical needs: Six federal Type 1 crews; One Type 3 helicopter are needed to meet incident objectives.,,,,Voluntary evacuations of the Camp Scheideck community  Reyes Creek Campground  the Grade Valley area including Thorne Meadow and Fish Bowls.  Trail systems connecting to the Pine Mountain to Piedra Blanca area are closed,Voluntary evacuations of the Camp Scheideck community  Reyes Creek Campground  the Grade Valley area including Thorne Meadow and Fish Bowls.  Trail systems connecting to the Pine Mountain to Piedra Blanca area are closed,Voluntary evacuations of the Camp Scheideck community  Reyes Creek Campground  the Grade Valley area including Thorne Meadow and Fish Bowls. Trail systems connecting to the Pine Mountain to Piedra Blanca area are closed.,,,400.0,2990055.0,,A,,,2977927,1500000.0,,,,,2989930.0,,,,1392.0,4269815,Gary Helming ICT3 Pete Stephenson ICT3 (T),,,,,,4268784,,,,Camp Scheideck community and nearby residences and ranches.,,KC28,0.0,,,,"Frazier Park, CA",,,34.6308333,,,,,,22W,5.0,6N,-119.2302778,Eleven miles north of Ojai in the Sespe wilderness,6.0,,,,,,,Peter Stephenson ICT(T),,Fire will continue to burn to the northeast and rollout to the Southwest will increase acreage. ,Fire will continue to burn to the northeast  and rollout to the Southwest will increase acreage. ,,,,,1500.0,2990055.0,07/07/2016 12:00:00,,07/01/2016 18:00:00,,2016-07-01 20:00:00,,,High potential for growth  heavy fuels  challenge with access  steep terrain.  Fire continues to burn to the Northeast.  Acreage increase in the Southwest due to roll-out.,,U,,,,,,,,A warm and dry air mass will continue across the fire area through Friday.  Humidity's will fall into the teens with poor overnight recovery. Slope SE Winds 4-8 in the morning  south 5-10 gust to 15 in the  afternoon  Ridge SE 5-10 in the morning  S 6-12 
18784,,,,,,2990066.0,2989917.0,,,,Critical needs: Six federal Type 1 crews; One Type 3 helicopter.,Critical needs: Six federal Type 1 crews; One Type 3 helicopter.,Six Federal Type 1 crews; One Type 3 helicopter.,,,Voluntary evacuations of the Camp Scheideck community  Reyes Creek Campground  the Grade Valley area including Thorne Meadow and Fish Bowls.  Trail systems connecting to the Pine Mountain to Piedra Blanca area are closed,Voluntary evacuations of the Camp Scheideck community  Reyes Creek Campground  the Grade Valley area including Thorne Meadow and Fish Bowls.  Trail systems connecting to the Pine Mountain to Piedra Blanca area are closed,Voluntary evacuations of the Camp Scheideck community  Reyes Creek Campground  the Grade Valley area including Thorne Meadow and Fish Bowls. Trail systems connecting to the Pine Mountain to Piedra Blanca area are closed.,,,300.0,2990055.0,,,,,2977927,,,,,,2989930.0,,,,1393.0,4269841,Gary Helming ICT3 Pete Stephenson ICT3 (T),,,,,,4268784,,,,Camp Scheideck community and nearby residences and ranches.,,,0.0,,,,"Frazier Park, CA",,,34.6308333,,,,,,22W,5.0,6N,-119.2302778,Eleven miles north of Ojai in the Sespe wilderness,6.0,,,,,,,,,Fire will continue to burn to the northeast  free burning  no containment due to no access and topography,Fire will continue to burn to the northeast  free burning  no containment due to no access and topography.,Fire will continue to burn to the northeast  free burning  no containment due to no access and topography.,Fire will continue to burn to the northeast  free burning  no containment due to no access and topography.,,,,,,,07/01/2016 14:00:00,,2016-07-01 18:00:00,,,High potential for growth  heavy fuels  challenge with access  steep terrain.,,U,,,,,,,,A warm and dry air mass will continue across the fire area through Friday.  Humidity's will fall into the teens with poor overnight recovery. Slope SE Winds 4-8 am  south 5-10 gust to 15 afternoon  Ridge SE 5-10 am  S 6-12 gust to 18pm
18794,,07/15/2016 12:00:00,Deron Mills,07/10/2016 07:21:19,Y,2990066.0,2989917.0,,dmartin05,,,,,,,Road closure remains in effect for the Grade Valley Road at the intersection of Lockwood Valley Road and the Pine Mountain Road at Highway 33.      Trail systems connecting Pine Mountain to Piedra Blanca area remain closed.  Voluntary evacuations of the C,Road closure remains in effect for the Grade Valley Road at the intersection of Lockwood Valley Road and the Pine Mountain Road at Highway 33.      Trail systems connecting Pine Mountain to Piedra Blanca area remain closed.  Voluntary evacuations of the C,,,,2304.0,2990055.0,,A,06/30/2016 10:54:00,,2977927,12400000.0,,,,,2989930.0,,,Potential for growth is attributed to continuous heavy fuels and topographic alignment throughout the fire.  Fire growth has slowed a lot.  Fire continues to burn due to dry conditions consuming ground fuels and litter.  ,1403.0,4269228,Deron Mills SCSIIMT,,,,,2990125.0,4268784,2990081.0,SIT209,,Camp Scheideck community and nearby residences and ranches.,,KC28,71.0,,100.0,,"Frazier Park, CA",111.0,,34.63,,,,,,22W,5.0,6N,-119.22366670000001,Eleven miles north of Ojai in the Sespe wilderness.,6.0,,,,,,,Dave Martin PSC2,07/10/2016 07:15:00,Although slowing considerably  minimal fire growth in Divisions I and M.  Predicted 6-18 mph north and west surface winds continued to buffer the fire. These winds are to continue throughout Saturday then begin to pick up in the evening.   Northwest winds,Northwest winds  Ridge top and slope are predicted to potentially increase more on Sunday  gusting to 40 MPH.  Roll out is still a contributing factor to fire spread. ,Warming and drying trend predicted. ,,,,,2990055.0,07/11/2016 12:00:00,,07/09/2016 20:00:00,,2016-07-10 08:00:00,Y,,,S,U,,,07/10/2016 07:21:19,SOPS,,,,DISCUSSION: A TROUGH OF LOW PRESSURE WILL MOVE THROUGH THE AREA TONIGHT BRINGING AN INCREASE IN WEST TO NORTHWEST WINDS FOR WESTERN PORTIONS OF THE SANTA YNEZ RANGE  THE I-5 CORRIDOR  AND THE ANTELOPE VALLEY. WEST TO NORTHWEST WINDS IN THESE AREAS WILL GU
18795,2989936.0,07/17/2016 12:00:00,R Aispuro,08/14/2016 19:10:55,Y,2990066.0,2989915.0,,bmspahr,08/14/2016 19:05:44,,,,,,A fire closure is proposed for the area immediately surrounding the fire. This area would be bounded by Reyes Creek on the east from the head waters to the confluence at Alamo Creek on the south.  Along Alamo to the east to the head waters in section 26  ,A fire closure is proposed for the area immediately surrounding the fire. This area would be bounded by Reyes Creek on the east from the head waters to the confluence at Alamo Creek on the south.  Along Alamo to the east to the head waters in section 26  ,,,,2304.0,2990055.0,2016.0,A,06/30/2016 10:54:00,,2977927,15500000.0,,2990332.0,,,2989930.0,,2990316.0,No reported fire growth today.  ,1404.0,4269868,William Rios ICT3 Ricky Aispuro ICT3(T),,,Pine,001986,2990125.0,4268784,2990084.0,SIT209,08/14/2016 19:10:55,Camp Scheideck community and nearby residences and ranches.,2990219.0,KC28,98.0,,100.0,Continue suppression repair. Monitor fire line from lookout points as necessary.,"Frazier Park, CA",111.0,2977927.0,34.63,2990041.0,,,,,22W,5.0,6N,-119.2236111,Eleven miles north of Ojai in the Sespe wilderness.,6.0,,,,,,,B Spahr,08/14/2016 19:00:00,Crews will continue to mop-up and do suppression repair   ,All line personnel will be flown off the line,Monitor with lookouts and air,,,15500000.0,2304.0,2990055.0,07/11/2016 12:00:00,Pine Incident will now rise to 98% containment. Also the Pine incident will be placed into Patrol Status as of 1800 07/28/2016  given back to the Mt. Pinos R.D duty officers to monitor the fire at their discretion. The incident will remain uncontained/unc,08/14/2016 08:00:00,,2016-08-14 20:00:00,Y,2989931.0,,S,U,Fire will be placed in patrol status (not 100 percent contained not controlled). Fire will continue to be monitored by lookouts based on duty officer discretion.,,08/14/2016 19:10:55,CA-OSCC,Y,N,,Elevated fire weather over the fire for gusty winds and low relative humidity's.
18796,2989936.0,07/17/2016 12:00:00,William Rios,07/18/2016 19:56:56,Y,2990066.0,2989915.0,,tframpton,07/18/2016 19:55:13,,,,,,A fire closure is proposed for the area immediately surrounding the fire. This area would be bounded by Reyes Creek on the east from the head waters to the confluence at Alamo Creek on the south.  Along Alamo to the east to the head waters in section 26  ,A fire closure is proposed for the area immediately surrounding the fire. This area would be bounded by Reyes Creek on the east from the head waters to the confluence at Alamo Creek on the south.  Along Alamo to the east to the head waters in section 26  ,,,,2304.0,2990055.0,2016.0,A,06/30/2016 10:54:00,,2977927,15500000.0,,,,,2989930.0,,2990316.0,No reported fire growth today.  ,1405.0,4269883,William Rios ICT3 Ricky Aispuro ICT3(T),,,Pine,001986,2990125.0,4268784,2990084.0,SIT209,07/23/2016 15:26:34,Camp Scheideck community and nearby residences and ranches.,2990219.0,KC28,96.0,,100.0,Continue suppression repair. Monitor fire line and insert crews where necessary. TFR for fires has been released. ,"Frazier Park, CA",111.0,2977927.0,34.63,2990041.0,,,,,22W,5.0,6N,-119.2236111,Eleven miles north of Ojai in the Sespe wilderness.,6.0,,,,,,,Ted Frampton,07/18/2016 20:00:00,Crews will continue to mop-up and do suppression repair   ,All line personnel will be flown off the line,Monitor with lookouts and air,,,,,2990055.0,07/11/2016 12:00:00,A District type 4 IC and trainee are proposed to take over the fire on 7\17\2016 at 1800 hours.  At that time all resources are proposed to be off the fire-line. The Fire will continue to be monitored by air and by lookouts. Crews will be inserted as nece,07/18/2016 08:00:00,,2016-07-18 20:00:00,Y,2989931.0,,S,U,Fire will continue to be monitored by aerial resources as well as lookouts.,,07/18/2016 19:56:56,South Ops,Y,N,,Elevated fire weather over the fire for gusty winds and low relative humidity's.
18812,,07/15/2016 12:00:00,,,,2990066.0,2989917.0,,,,,,,,,A fire closer is proposed for the area immediately surrounding the fire. This area would be bounded by Reyes Creek on the east from the head waters to the confluence at Alamo Creek on the south.  Along Alamo to the east to the head waters in section 26  t,A fire closer is proposed for the area immediately surrounding the fire. This area would be bounded by Reyes Creek on the east from the head waters to the confluence at Alamo Creek on the south.  Along Alamo to the east to the head waters in section 26  t,Soft road closure remains in effect for the Grade Valley Road at the intersection of Lockwood Valley Road and the Pine Mountain Road at Highway 33.  ,,,2304.0,2990055.0,,A,,,2977927,14500000.0,,,,,2989930.0,,,No reported fire growth today.  ,1421.0,4269269,Deron Mills SCSIIMT,,,,,,4268784,,,,Camp Scheideck community and nearby residences and ranches.,,KC28,93.0,,,,"Frazier Park, CA",,,34.63,,,,,,22W,5.0,6N,-119.2236111,Eleven miles north of Ojai in the Sespe wilderness.,6.0,,,,,,,Mark Lemon,07/12/2016 20:00:00,Low humidity continues.  Crews will continue to mop-up and reinforce fireline where necessary.   ,Possible interior activity continues with predicted north wind and low humidity.  Crews will continue to mop-up and reinforce fireline where necessary.     ,Warming and drying trend predicted. ,,,,,2990055.0,07/11/2016 12:00:00,,07/12/2016 08:00:00,,2016-07-12 20:00:00,,,Few areas of smoke were observed on fire today,S,U,Large scale demob of resources will continue. Mop-up continued along Pine Mountain Ridge to Cedar Creek Trail.  Mop-up continues along the  fireline in Divisions M and I.  Crews in Divisions A/D/S and Z hold and improve the lines and monitored inaccessibl,,07/12/2016 20:01:46,SOPS,,,,A WARMING TREND IS EXPECTED FOR INLAND AREAS THROUGH THURSDAY AS UPPER LEVEL HIGH PRESSURE OVER NORTHERN MEXICO EXPANDS NORTHWESTWARD. VERY DRY CONDITIONS WILL CONTINUE FOR INTERIOR AREAS THIS WEEK...WITH MINIMUM HUMIDITIES IN THE TEENS AND SINGLE DIGITS 
18813,2989936.0,07/17/2016 12:00:00,Ricky Aispuro,07/28/2016 19:30:22,Y,2990066.0,2989915.0,,bmspahr,07/28/2016 19:30:03,,,,,,A fire closure is proposed for the area immediately surrounding the fire. This area would be bounded by Reyes Creek on the east from the head waters to the confluence at Alamo Creek on the south.  Along Alamo to the east to the head waters in section 26  ,A fire closure is proposed for the area immediately surrounding the fire. This area would be bounded by Reyes Creek on the east from the head waters to the confluence at Alamo Creek on the south.  Along Alamo to the east to the head waters in section 26  ,,,,2304.0,2990055.0,2016.0,A,06/30/2016 10:54:00,,2977927,15500000.0,,,,,2989930.0,,2990316.0,No reported fire growth today.  ,1422.0,4269901,William Rios ICT3 Ricky Aispuro ICT3(T),,,Pine,001986,2990125.0,4268784,2990084.0,SIT209,07/28/2016 19:30:22,Camp Scheideck community and nearby residences and ranches.,2990219.0,KC28,96.0,,100.0,Continue suppression repair. Monitor fire line from lookout points as necessary.,"Frazier Park, CA",111.0,2977927.0,34.63,2990041.0,,,,,22W,5.0,6N,-119.2236111,Eleven miles north of Ojai in the Sespe wilderness.,6.0,,,,,,,Jesse Pereira,07/28/2016 20:00:00,Crews will continue to mop-up and do suppression repair   ,All line personnel will be flown off the line,Monitor with lookouts and air,,,,2304.0,2990055.0,07/11/2016 12:00:00,Pine Incident will now rise to 98% containment. Also the Pine incident will be placed into Patrol Status as of 1800 07/28/2016  given back to the Mt. Pinos R.D duty officers to monitor the fire at their discretion. The incident will remain uncontained/unc,07/28/2016 08:00:00,,2016-07-28 20:00:00,Y,2989931.0,,S,U,Fire will be placed in patrol status (not 100 percent contained not controlled). Fire will continue to be monitored by lookouts based on duty officer discretion.,,07/28/2016 19:30:22,CA-OSCC,Y,N,,Elevated fire weather over the fire for gusty winds and low relative humidity's.
18835,,07/15/2016 12:00:00,,,,2990066.0,2989917.0,,,,,,,,,Road closure remains in effect for the Grade Valley Road at the intersection of Lockwood Valley Road and the Pine Mountain Road at Highway 33.      Trail systems connecting Pine Mountain to Piedra Blanca area remain closed.  Voluntary evacuations of the C,,,,,2198.0,2990055.0,,A,,,2977927,8100000.0,,,,,2989930.0,1.0,,Backing fires tend to back against the wind and burn under the tree crowns with some torching during uphill runs.  Potential for growth is attributed to continuous heavy fuels and topographic alignment throughout the fire.  Fire continues to burn under dr,1444.0,4269296,Deron Mills SCSIIMT,,,,,,4268784,,,,Camp Scheideck community and nearby residences and ranches.,,KC28,35.0,,,,"Frazier Park, CA",,,34.6308333,,,,,,22W,5.0,6N,-119.2302778,Eleven miles north of Ojai in the Sespe wilderness.,6.0,,,,,,,,,Last nights IR shows that most of the fire growth was in Divisions I and M fire growth continue to the north. Predicted 6-18 mph north and west surface winds continued to buffer thee fire. These winds are to continue throughout Thursday.  The fire was obs,Northwest winds  Ridge top and slope are predicted to continue.  Roll out is still a contributing factor to fire spread. ,Northwest winds  Ridge top and slope are predicted to continue.  Roll out is still a contributing factor to fire spread. ,,,,,2990055.0,,,07/06/2016 20:00:00,,2016-07-07 08:00:00,,,Rolling material continues to contribute to fires spread. Potential for growth is attributed to continuous heavy fuels and topographic alignment throughout the fire. Fire continues to burn under dry conditions consuming ground fuels and litter. Backing fi,,U,,,,,,,, A TROUGH OF LOW PRESSURE ALOFT WILL GENERALLY  PERSIST OVER THE AREA THROUGH THE PERIOD. THIS TROUGH WILL SUPPORT  DRY SOUTHWEST WINDS ALOFT AND VERY LITTLE DAY TO DAY VARIATIONS IN  WEATHER CONDITIONS THROUGH THE FORECAST. GUSTY SOUTHWEST WINDS  WILL CO
18857,,02/18/2016 12:00:00,J. Bates - Choctaw Fire,02/20/2016 17:58:52,N,2990063.0,2989915.0,,Eoroscosr,02/20/2016 17:56:24,,,,,,None,,,,,1641.0,2990055.0,2016.0,A,02/16/2016 10:00:00,,2979313,3000.0,,,,,2989929.0,,2990316.0,,1466.0,4271462,UNKN,,,GENE ALLEN CORRAL,016005,2990125.0,4271461,2990084.0,SIT209,02/20/2016 17:58:52,,,J55J,100.0,,100.0,,,121.0,,34.6833333,,,,,,,,,-95.5691667,"10.7 Miles S. of Hartshorne, OK",40.0,,,,,,,BIA/AOICC,02/20/2016 17:00:00,None,,,,,,,,,,02/16/2016 10:00:00,,2016-02-19 19:00:00,N,2989935.0,,S,F,,,02/20/2016 17:58:52,SACC,N,N,,
18867,,07/15/2016 12:00:00,,,,2990066.0,2989917.0,,,,,,,,,Road closure remains in effect for the Grade Valley Road at the intersection of Lockwood Valley Road and the Pine Mountain Road at Highway 33.      Trail systems connecting Pine Mountain to Piedra Blanca area remain closed.  Voluntary evacuations of the C,,,,,2058.0,2990055.0,,A,,,2977927,8100000.0,,,,,2989930.0,1.0,,Rolling material on the continues to contribute to fires spread.  Potential for growth is attributed to continuous heavy fuels and topographic alignment throughout the fire.  Fire continues to burn under dry conditions consuming ground fuels and litter. B,1476.0,4269339,Deron Mills SCSIIMT,,,,,,4268784,,,,Camp Scheideck community and nearby residences and ranches.,,KC28,30.0,,,,"Frazier Park, CA",,,34.6308333,,,,,,22W,5.0,6N,-119.2302778,Eleven miles north of Ojai in the Sespe wilderness.,6.0,,,,,,,,,Fire growth continues on the north end of the fire  with most of the movement to the north and west on Divisions I and M. Predicted 6-18 mph north and west surface winds continued to buffer thee fire. These winds are to continue throughout Thursday.  The ,Northwest winds  Ridge top and slope are predicted to continue.  Roll out is still a contributing factor to fire spread. ,Northwest winds  Ridge top and slope are predicted to continue.  Roll out is still a contributing factor to fire spread. ,,,,,2990055.0,,,07/06/2016 08:00:00,,2016-07-06 20:00:00,,,Rolling material continues to contribute to fires spread. Potential for growth is attributed to continuous heavy fuels and topographic alignment throughout the fire. Fire continues to burn under dry conditions consuming ground fuels and litter. Backing fi,,U,,,,,,,,A BROAD TROUGH OF LOW PRESSURE WILL GENERALLY PERSIST OVER THE AREA THROUGH THE PERIOD. THIS TROUGH WILL SUPPORT DRY SOUTHWEST WINDS ALOFT AND VERY LITTLE DAY TO DAY VARIATIONS IN WEATHER CONDITIONS THROUGH THE FORECAST. DRY AND GUSTY SOUTHWEST WINDS WILL
18894,,07/15/2016 12:00:00,Deron Mills IC,07/08/2016 19:42:53,,2990066.0,2989917.0,,dmartin05,07/08/2016 16:36:24,,,,,,,,,,,2304.0,2990055.0,,A,06/30/2016 10:54:00,1.0,2977927,11300000.0,,,,,2989930.0,1.0,,Backing fires tend to back against the wind and burn under the tree crowns with some torching during uphill runs.  Potential for growth is attributed to continuous heavy fuels and topographic alignment throughout the fire.  Fire continues to burn under dr,1503.0,4269383,Deron Mills SCSIIMT,,,Pine,,2990125.0,4268784,2990081.0,SIT209,,Camp Scheideck community and nearby residences and ranches.,,KC28,50.0,,100.0,,"Frazier Park, CA",111.0,2977927.0,34.6308333,,,,,,22W,5.0,6N,-119.2302778,Eleven miles north of Ojai in the Sespe wilderness.,6.0,,,,,,,Dave Martin PSC,07/08/2016 19:45:00,Although slowing considerably  most of the fire growth was to the north in Divisions I and M. Predicted 6-18 mph north and west surface winds continued to buffer the fire. These winds are to continue throughout Friday.  The fire was observed actively back,Northwest winds  Ridge top and slope are predicted to increase on Saturday.  Roll out is still a contributing factor to fire spread. ,Northwest winds  Ridge top and slope are predicted to potentially increase more on Sunday  gusting to 40 MPH.  Roll out is still a contributing factor to fire spread. ,,,,,2990055.0,07/15/2016 12:00:00,,07/08/2016 08:00:00,,2016-07-08 20:00:00,Y,,Rolling material continues to contribute to fires spread. Potential for growth is attributed to continuous heavy fuels and topographic alignment throughout the fire. Fire continues to burn under dry conditions consuming ground fuels and litter. Backing fi,S,U,,,07/08/2016 19:42:53,SOPS,,,, DISCUSSION...A TROUGH OF LOW PRESSURE ON THE WEST COAST WILL DEEPEN  ACROSS CALIFORNIA THIS WEEKEND. FOR TODAY...THE GUSTY ONSHORE WINDS  WILL MOSTLY BE FOCUSED ACROSS THE ANTELOPE VALLEY AND LOS ANGELES COUNTY  MOUNTAINS. OVER THE WEEKEND...WEST TO NORT
18912,,07/15/2016 12:00:00,Deron Mills IC,07/09/2016 07:28:13,,2990066.0,2989917.0,,dmartin05,07/08/2016 23:18:33,,,,,,,,,,,2304.0,2990055.0,,A,06/30/2016 10:54:00,1.0,2977927,11500000.0,,,,,2989930.0,1.0,,Backing fires tend to back against the wind and burn under the tree crowns with some torching during uphill runs.  Potential for growth is attributed to continuous heavy fuels and topographic alignment throughout the fire.  Fire continues to burn under dr,1521.0,4269425,Deron Mills SCSIIMT,,,Pine,,2990125.0,4268784,2990081.0,SIT209,,Camp Scheideck community and nearby residences and ranches.,,KC28,52.0,,100.0,,"Frazier Park, CA",111.0,2977927.0,34.6308333,,,,,,22W,5.0,6N,-119.2302778,Eleven miles north of Ojai in the Sespe wilderness.,6.0,,,,,,,Dave Martin PSC,07/09/2016 07:30:00,Although slowing considerably  most of the fire growth was to the north in Divisions I and M. Predicted 6-18 mph north and west surface winds continued to buffer the fire. These winds are to continue throughout Saturday then begin to pick up in the evenin,Northwest winds  Ridge top and slope are predicted to increase on Saturday.  Roll out is still a contributing factor to fire spread. ,Northwest winds  Ridge top and slope are predicted to potentially increase more on Sunday  gusting to 40 MPH.  Roll out is still a contributing factor to fire spread. ,,,,,2990055.0,07/11/2016 12:00:00,,07/08/2016 20:00:00,,2016-07-09 08:00:00,Y,,Rolling material continues to contribute to fires spread. Potential for growth is attributed to continuous heavy fuels and topographic alignment throughout the fire. Fire continues to burn under dry conditions consuming ground fuels and litter. Backing fi,S,U,,,07/09/2016 07:28:13,SOPS,,,, DISCUSSION...A TROUGH OF LOW PRESSURE ON THE WEST COAST WILL DEEPEN ACROSS CALIFORNIA THIS WEEKEND. FOR TODAY...THE GUSTY ONSHORE WINDS  WILL MOSTLY BE FOCUSED ACROSS THE ANTELOPE VALLEY AND LOS ANGELES COUNTY  MOUNTAINS. OVER THE WEEKEND...WEST TO NORTH
18932,,07/15/2016 12:00:00,,,,2990066.0,2989917.0,,,,,,,,,Road closure remains in effect for the Grade Valley Road at the intersection of Lockwood Valley Road and the Pine Mountain Road at Highway 33.      Trail systems connecting Pine Mountain to Piedra Blanca area remain closed.  Voluntary evacuations of the C,,,,,2248.0,2990055.0,,A,,,2977927,9700000.0,,,,,2989930.0,1.0,,Backing fires tend to back against the wind and burn under the tree crowns with some torching during uphill runs.  Potential for growth is attributed to continuous heavy fuels and topographic alignment throughout the fire.  Fire continues to burn under dr,1541.0,4269466,Deron Mills SCSIIMT,,,,,,4268784,,,,Camp Scheideck community and nearby residences and ranches.,,KC28,40.0,,,,"Frazier Park, CA",,,34.6308333,,,,,,22W,5.0,6N,-119.2302778,Eleven miles north of Ojai in the Sespe wilderness.,6.0,,,,,,,,,Last nights IR shows that most of the fire growth was in Divisions I and M fire growth continue to the north. Predicted 6-18 mph north and west surface winds continued to buffer the fire. These winds are to continue throughout Thursday.  The fire was obse,Northwest winds  Ridge top and slope are predicted to continue.  Roll out is still a contributing factor to fire spread. ,Northwest winds  Ridge top and slope are predicted to continue.  Roll out is still a contributing factor to fire spread. ,,,,,2990055.0,,,07/07/2016 08:00:00,,2016-07-07 20:00:00,,,Rolling material continues to contribute to fires spread. Potential for growth is attributed to continuous heavy fuels and topographic alignment throughout the fire. Fire continues to burn under dry conditions consuming ground fuels and litter. Backing fi,,U,,,,,,,,DISCUSSION...A TROUGH OF LOW PRESSURE ALOFT ON THE WEST COAST  WILL CONTINUE TO BRING GENERALLY PERSISTENT WEATHER CONDITIONS  THROUGH THE FORECAST PERIOD. GUSTY AFTERNOON SOUTHWEST WINDS  COMBINED WITH MINIMUM RELATIVE HUMIDITIES FROM THE LOWER TEENS TO 
18947,,07/07/2016 12:00:00,,,,2990066.0,2989917.0,,,,,,,,,Trail systems connecting Pine Mountain to Piedra Blanca area remain closed.  Voluntary evacuations of the Camp Scheideck community  Reyes Creek Campground  the Grade Valley area including Thorne Meadow and Fish Bowls continue.  ,Trail systems connecting Pine Mountain to Piedra Blanca area remain closed.  Voluntary evacuations of the Camp Scheideck community  Reyes Creek Campground  the Grade Valley area including Thorne Meadow and Fish Bowls.  ,Voluntary evacuations of the Camp Scheideck community  Reyes Creek Campground  the Grade Valley area including Thorne Meadow and Fish Bowls. Trail systems connecting to the Pine Mountain to Piedra Blanca area are closed continue.,,,1590.0,2990055.0,,A,,,2977927,2800000.0,,,,,2989930.0,1.0,,,1556.0,4268861,Deron Mills SCSIIMT,,,,,,4268784,,,,Camp Scheideck community and nearby residences and ranches.,,KC28,0.0,,,,"Frazier Park, CA",111.0,,34.6308333,,,,,,22W,5.0,6N,-119.2302778,Eleven miles north of Ojai in the Sespe wilderness.,6.0,,,,,,,Mark Lemon,07/02/2016 20:00:00,South to Southwest winds will continue increase acreage as the Fire burn to the north and northeast. Roll out is still a contributing factor to fire spread.,South to Southwest winds will continue increase acreage as the Fire burn to the north and northeast. Roll out is still a contributing factor to fire spread.,,,,,,2990055.0,07/07/2016 12:00:00,,07/02/2016 08:00:00,,2016-07-02 20:00:00,,,Rolling material continues to dominate fires spread in steep inaccessible terrain  allowing for multiple uphill runs.   High potential for growth is attributed to continuous heavy flashy fuels  southerly winds and topographic alignment. Fire continues to ,,U,,,,SOPS,,,,AN UPPER LEVEL TROUGH OF LOW PRESSURE AND DRY  SOUTHWEST WINDS ALOFT WILL PREVAIL OVER THE AREA THROUGH  NEXT WEEK THURSDAY. A RELATIVELY DEEP MARINE LAYER IS EXPECTED  TO PERSIST NEAR SHORE AS A MODERATE ONSHORE PRESSURE GRADIENT  DEVELOPS EACH AFTERNOON
18948,,07/15/2016 12:00:00,,,,2990066.0,2989917.0,,,,,,,,,Road closure remains in effect for the Grade Valley Road at the intersection of Lockwood Valley Road and the Pine Mountain Road at Highway 33.      Trail systems connecting Pine Mountain to Piedra Blanca area remain closed.  Voluntary evacuations of the C,,,,,2304.0,2990055.0,,A,,,2977927,9900000.0,,,,,2989930.0,1.0,,Backing fires tend to back against the wind and burn under the tree crowns with some torching during uphill runs.  Potential for growth is attributed to continuous heavy fuels and topographic alignment throughout the fire.  Fire continues to burn under dr,1557.0,4269508,Deron Mills SCSIIMT,,,,,,4268784,,,,Camp Scheideck community and nearby residences and ranches.,,KC28,42.0,,,,"Frazier Park, CA",,,34.6308333,,,,,,22W,5.0,6N,-119.2302778,Eleven miles north of Ojai in the Sespe wilderness.,6.0,,,,,,,,,Although slowing considerably  most of the fire growth was to the north in Divisions I and M. Predicted 6-18 mph north and west surface winds continued to buffer the fire. These winds are to continue throughout Friday.  The fire was observed actively back,Northwest winds  Ridge top and slope are predicted to continue.  Roll out is still a contributing factor to fire spread. ,Northwest winds  Ridge top and slope are predicted to continue.  Roll out is still a contributing factor to fire spread. ,,,,,2990055.0,,,07/07/2016 20:00:00,,2016-07-08 08:00:00,,,Rolling material continues to contribute to fires spread. Potential for growth is attributed to continuous heavy fuels and topographic alignment throughout the fire. Fire continues to burn under dry conditions consuming ground fuels and litter. Backing fi,,U,,,,,,,,DISCUSSION...A TROUGH OF LOW PRESSURE ALOFT ON THE WEST COAST  WILL CONTINUE TO BRING GENERALLY PERSISTENT WEATHER CONDITIONS  THROUGH THE FORECAST PERIOD. GUSTY AFTERNOON SOUTHWEST WINDS  COMBINED WITH MINIMUM RELATIVE HUMIDITIES FROM THE LOWER TEENS TO 
18957,,,,,N,2990063.0,2989914.0,,ifm,05/13/2015 10:39:28,,,,,,,,,,,0.1,2990055.0,2016.0,D,04/02/2015 18:10:40,,2979829,,,,,,,,,,1566.0,4272302,Morse  Collin,,,Tustemena Boat Launch,503012,2990125.0,4272301,2990085.0,SIT209,05/13/2015 10:39:28,,2990113.0,JLK5,,,0.0,,,122.0,,60.25345,,,,,,,,,-151.17308300000002,,2.0,,,,,,,,,,,,,,,,,,,04/03/2015 21:00:00,,2015-04-04 21:00:00,N,,,S,I,,,,,N,N,,
18964,,,,,,2990066.0,2989917.0,,,,Critical needs: Six federal Type 1 crews; One Type 3 helicopter are needed to meet incident objectives.  8 SFOR for line safety,,,,,Trail systems connecting Pine Mountain to Piedra Blanca area remain closed.  Voluntary evacuations of the Camp Scheideck community  Reyes Creek Campground  the Grade Valley area including Thorne Meadow and Fish Bowls continue.  ,Trail systems connecting Pine Mountain to Piedra Blanca area remain closed.  Voluntary evacuations of the Camp Scheideck community  Reyes Creek Campground  the Grade Valley area including Thorne Meadow and Fish Bowls.  ,Voluntary evacuations of the Camp Scheideck community  Reyes Creek Campground  the Grade Valley area including Thorne Meadow and Fish Bowls. Trail systems connecting to the Pine Mountain to Piedra Blanca area are closed continue.,,,1450.0,2990055.0,,,,,2977927,1500000.0,,,,,2989930.0,,,Numbers of threatened structures are an estimation.,1573.0,4268896,Deron Mills SCSIIMT,,,,,,4268784,,,,Camp Scheideck community and nearby residences and ranches.,,KC28,0.0,,,,"Frazier Park, CA",,,34.6308333,,,,,,22W,5.0,6N,-119.2302778,Eleven miles north of Ojai in the Sespe wilderness.,6.0,,,,,,,,,Rollout to the Southwest will continue increase acreage as the Fire burn to the north and northeast.,Rollout to the Southwest will continue increase acreage as the Fire burn to the north and northeast.,,,,,,2990055.0,,,07/01/2016 22:15:00,,2016-07-02 08:00:00,,,High potential for growth continues due to heavy fuels and steep inaccessible terrain. Fire continues to burn active.  Roll-out continues to be an issue  allowing the fire to continue to spread.,,U,,,,SOPS,,,,ONSHORE FLOW WILL CONTINUE THROUGH THE MIDDLE OF NEXT WEEK AS A WEAK TROUGH SETTLES OVER THE REGION. INTERIOR SECTIONS WILL REMAIN DRY WITH HIGHER MOUNTAIN  HUMIDITIES UNDER 10 PERCENT AND VERY POOR OVERNIGHT RECOVERIES  UNDER 30 PERCENT. GUSTY SOUTHWEST 
